uniprot_id,gene_name,length,entry_type,description,is_essential
tr|A6TCQ1|A6TCQ1_KLEP7,KPN_02966,288,unreviewed (tr),tr|A6TCQ1|A6TCQ1_KLEP7 Transcriptional regulator (LysR family) OS=Klebsiella pneumoniae subsp. pneum,False
tr|A6TCQ2|A6TCQ2_KLEP7,KPN_02967,190,unreviewed (tr),tr|A6TCQ2|A6TCQ2_KLEP7 Flavin reductase like domain-containing protein OS=Klebsiella pneumoniae subs,False
tr|A6TCQ3|A6TCQ3_KLEP7,KPN_02968,121,unreviewed (tr),"tr|A6TCQ3|A6TCQ3_KLEP7 Helix-turn-helix, AraC type OS=Klebsiella pneumoniae subsp. pneumoniae (strai",False
tr|A6TCQ4|A6TCQ4_KLEP7,KPN_02969,391,unreviewed (tr),tr|A6TCQ4|A6TCQ4_KLEP7 Secretion protein HlyD OS=Klebsiella pneumoniae subsp. pneumoniae (strain ATC,False
tr|A6TCQ6|A6TCQ6_KLEP7,KPN_02971,159,unreviewed (tr),tr|A6TCQ6|A6TCQ6_KLEP7 Transcriptional regulator OS=Klebsiella pneumoniae subsp. pneumoniae (strain ,False
tr|A6TCQ7|A6TCQ7_KLEP7,KPN_02972,303,unreviewed (tr),"tr|A6TCQ7|A6TCQ7_KLEP7 Bacterial regulatory protein, LysR OS=Klebsiella pneumoniae subsp. pneumoniae",False
tr|A6TCQ8|A6TCQ8_KLEP7,KPN_02973,316,unreviewed (tr),tr|A6TCQ8|A6TCQ8_KLEP7 Arginase/agmatinase/formiminoglutamase OS=Klebsiella pneumoniae subsp. pneumo,False
tr|A6TCQ9|A6TCQ9_KLEP7,KPN_02974,287,unreviewed (tr),tr|A6TCQ9|A6TCQ9_KLEP7 Xylose isomerase-like protein OS=Klebsiella pneumoniae subsp. pneumoniae (str,False
tr|A6TCR0|A6TCR0_KLEP7,KPN_02975,355,unreviewed (tr),tr|A6TCR0|A6TCR0_KLEP7 Oxidoreductase OS=Klebsiella pneumoniae subsp. pneumoniae (strain ATCC 700721,False
tr|A6TCR1|A6TCR1_KLEP7,KPN_02976,268,unreviewed (tr),"tr|A6TCR1|A6TCR1_KLEP7 Bacterial extracellular solute-binding protein, family 3 OS=Klebsiella pneumo",False
tr|A6TCR3|A6TCR3_KLEP7,KPN_02978,242,unreviewed (tr),tr|A6TCR3|A6TCR3_KLEP7 L-fuculose phosphate aldolase OS=Klebsiella pneumoniae subsp. pneumoniae (str,False
tr|A6TCR4|A6TCR4_KLEP7,KPN_02979,310,unreviewed (tr),tr|A6TCR4|A6TCR4_KLEP7 2-ketoacid reductase OS=Klebsiella pneumoniae subsp. pneumoniae (strain ATCC ,False
tr|A6TCR5|A6TCR5_KLEP7,KPN_02980,264,unreviewed (tr),tr|A6TCR5|A6TCR5_KLEP7 Short-chain dehydrogenase/reductase OS=Klebsiella pneumoniae subsp. pneumonia,False
tr|A6TCR6|A6TCR6_KLEP7,KPN_02981,206,unreviewed (tr),tr|A6TCR6|A6TCR6_KLEP7 Transport protein OS=Klebsiella pneumoniae subsp. pneumoniae (strain ATCC 700,False
tr|A6TCR7|A6TCR7_KLEP7,KPN_02982,282,unreviewed (tr),tr|A6TCR7|A6TCR7_KLEP7 Solute-binding protein family 3/N-terminal domain-containing protein OS=Klebs,False
tr|A6TCR8|A6TCR8_KLEP7,fimZ,205,unreviewed (tr),tr|A6TCR8|A6TCR8_KLEP7 Transcriptional regulator of fimbrial expression OS=Klebsiella pneumoniae sub,False
tr|A6TCR9|A6TCR9_KLEP7,fimA,173,unreviewed (tr),tr|A6TCR9|A6TCR9_KLEP7 Major type 1 subunit fimbrin (Pilin) OS=Klebsiella pneumoniae subsp. pneumoni,False
tr|A6TCS0|A6TCS0_KLEP7,fim,222,unreviewed (tr),tr|A6TCS0|A6TCS0_KLEP7 Probable pilin chaperone OS=Klebsiella pneumoniae subsp. pneumoniae (strain A,False
tr|A6TCS1|A6TCS1_KLEP7,fimD,845,unreviewed (tr),tr|A6TCS1|A6TCS1_KLEP7 Outer membrane protein export and assembly of type 1 fimbriae OS=Klebsiella p,False
tr|A6TCS2|A6TCS2_KLEP7,fim,364,unreviewed (tr),tr|A6TCS2|A6TCS2_KLEP7 Fimbrial-like protein OS=Klebsiella pneumoniae subsp. pneumoniae (strain ATCC,False
tr|A6TCS3|A6TCS3_KLEP7,fimD,829,unreviewed (tr),"tr|A6TCS3|A6TCS3_KLEP7 Export and assembly of type 1 fimbriae, usher OS=Klebsiella pneumoniae subsp.",False
tr|A6TCS4|A6TCS4_KLEP7,fim,220,unreviewed (tr),tr|A6TCS4|A6TCS4_KLEP7 Chaperone OS=Klebsiella pneumoniae subsp. pneumoniae (strain ATCC 700721 / MG,False
tr|A6TCS5|A6TCS5_KLEP7,fim,193,unreviewed (tr),tr|A6TCS5|A6TCS5_KLEP7 Fimbrial-like protein OS=Klebsiella pneumoniae subsp. pneumoniae (strain ATCC,False
tr|A6TCS6|A6TCS6_KLEP7,aldB,506,unreviewed (tr),tr|A6TCS6|A6TCS6_KLEP7 Aldehyde dehydrogenase B (Lactaldehyde dehydrogenase) OS=Klebsiella pneumonia,False
tr|A6TCS7|A6TCS7_KLEP7,prpR,595,unreviewed (tr),"tr|A6TCS7|A6TCS7_KLEP7 Helix-turn-helix, Fis-type OS=Klebsiella pneumoniae subsp. pneumoniae (strain",False
tr|A6TCS8|A6TCS8_KLEP7,yafC,302,unreviewed (tr),tr|A6TCS8|A6TCS8_KLEP7 Transcriptional regulator (LysR family) OS=Klebsiella pneumoniae subsp. pneum,False
tr|A6TCT0|A6TCT0_KLEP7,ygaV,99,unreviewed (tr),tr|A6TCT0|A6TCT0_KLEP7 HTH arsR-type domain-containing protein OS=Klebsiella pneumoniae subsp. pneum,False
tr|A6TCT1|A6TCT1_KLEP7,ygaP,181,unreviewed (tr),tr|A6TCT1|A6TCT1_KLEP7 Phosphatase OS=Klebsiella pneumoniae subsp. pneumoniae (strain ATCC 700721 / ,False
tr|A6TCT2|A6TCT2_KLEP7,KPN_02997,300,unreviewed (tr),tr|A6TCT2|A6TCT2_KLEP7 Aspartyl/asparaginy/proline hydroxylase domain-containing protein OS=Klebsiel,False
tr|A6TCT5|A6TCT5_KLEP7,ygaC,120,unreviewed (tr),tr|A6TCT5|A6TCT5_KLEP7 DUF2002 family protein OS=Klebsiella pneumoniae subsp. pneumoniae (strain ATC,False
tr|A6TCT6|A6TCT6_KLEP7,ygaM,115,unreviewed (tr),tr|A6TCT6|A6TCT6_KLEP7 DUF883 domain-containing protein OS=Klebsiella pneumoniae subsp. pneumoniae (,False
tr|A6TCT7|A6TCT7_KLEP7,KPN_03002,424,unreviewed (tr),"tr|A6TCT7|A6TCT7_KLEP7 Bacterial regulatory protein, GntR OS=Klebsiella pneumoniae subsp. pneumoniae",False
tr|A6TCT8|A6TCT8_KLEP7,KPN_03003,143,unreviewed (tr),tr|A6TCT8|A6TCT8_KLEP7 Carboxymuconolactone decarboxylase-like domain-containing protein OS=Klebsiel,False
tr|A6TCT9|A6TCT9_KLEP7,nrdH,61,unreviewed (tr),tr|A6TCT9|A6TCT9_KLEP7 Glutaredoxin-like protein hydrogen donor OS=Klebsiella pneumoniae subsp. pneu,False
sp|A6TCU0|NRDI_KLEP7,nrdI,136,reviewed (sp),sp|A6TCU0|NRDI_KLEP7 Protein NrdI OS=Klebsiella pneumoniae subsp. pneumoniae (strain ATCC 700721 / M,False
tr|A6TCU5|A6TCU5_KLEP7,proX,327,unreviewed (tr),"tr|A6TCU5|A6TCU5_KLEP7 Glycine/betaine/proline transport protein (ABC superfamily, peri_bind) OS=Kle",False
tr|A6TCU6|A6TCU6_KLEP7,ygaZ,248,unreviewed (tr),tr|A6TCU6|A6TCU6_KLEP7 Amino acid transport protein OS=Klebsiella pneumoniae subsp. pneumoniae (stra,False
tr|A6TCU7|A6TCU7_KLEP7,ygaH,111,unreviewed (tr),tr|A6TCU7|A6TCU7_KLEP7 Transport protein OS=Klebsiella pneumoniae subsp. pneumoniae (strain ATCC 700,False
tr|A6TCU8|A6TCU8_KLEP7,emrR,143,unreviewed (tr),tr|A6TCU8|A6TCU8_KLEP7 Regulator of plasmid mcrB operon (Microcin B17 synthesis) OS=Klebsiella pneum,False
tr|A6TCV0|A6TCV0_KLEP7,emrB,512,unreviewed (tr),tr|A6TCV0|A6TCV0_KLEP7 Multidrug resistance probably membrane translocase OS=Klebsiella pneumoniae s,False
tr|A6TCV2|A6TCV2_KLEP7,KPN_03017,255,unreviewed (tr),tr|A6TCV2|A6TCV2_KLEP7 Arabinose operon regulatory protein OS=Klebsiella pneumoniae subsp. pneumonia,False
tr|A6TCV5|A6TCV5_KLEP7,yqaA,142,unreviewed (tr),tr|A6TCV5|A6TCV5_KLEP7 Integral membrane protein OS=Klebsiella pneumoniae subsp. pneumoniae (strain ,False
tr|A6TCV6|A6TCV6_KLEP7,yqaB,188,unreviewed (tr),tr|A6TCV6|A6TCV6_KLEP7 Phosphatase OS=Klebsiella pneumoniae subsp. pneumoniae (strain ATCC 700721 / ,False
tr|A6TCV7|A6TCV7_KLEP7,KPN_03022,104,unreviewed (tr),tr|A6TCV7|A6TCV7_KLEP7 Osmotically-inducible protein Y OS=Klebsiella pneumoniae subsp. pneumoniae (s,False
tr|A6TCW2|A6TCW2_KLEP7,ygaD,165,unreviewed (tr),tr|A6TCW2|A6TCW2_KLEP7 Competence damage-inducible protein A OS=Klebsiella pneumoniae subsp. pneumon,False
tr|A6TCW3|A6TCW3_KLEP7,KPN_03033,293,unreviewed (tr),tr|A6TCW3|A6TCW3_KLEP7 Periplasmic solute binding protein OS=Klebsiella pneumoniae subsp. pneumoniae,False
tr|A6TCW4|A6TCW4_KLEP7,KPN_03034,287,unreviewed (tr),tr|A6TCW4|A6TCW4_KLEP7 ABC transporter membrane protein OS=Klebsiella pneumoniae subsp. pneumoniae (,False
tr|A6TCW5|A6TCW5_KLEP7,KPN_03035,236,unreviewed (tr),tr|A6TCW5|A6TCW5_KLEP7 ABC transporter ATP-binding protein OS=Klebsiella pneumoniae subsp. pneumonia,False
tr|A6TCW6|A6TCW6_KLEP7,mltB,329,unreviewed (tr),tr|A6TCW6|A6TCW6_KLEP7 Membrane-bound lytic murein transglycosylase B OS=Klebsiella pneumoniae subsp,False
tr|A6TCW7|A6TCW7_KLEP7,srlA,187,unreviewed (tr),"tr|A6TCW7|A6TCW7_KLEP7 PTS family enzyme IIC, glucitol/sorbitol-specific OS=Klebsiella pneumoniae su",False
tr|A6TCW8|A6TCW8_KLEP7,srlE,326,unreviewed (tr),"tr|A6TCW8|A6TCW8_KLEP7 PTS family enzyme IIBC, glucitol/sorbitol-specific OS=Klebsiella pneumoniae s",False
tr|A6TCW9|A6TCW9_KLEP7,srlB,120,unreviewed (tr),"tr|A6TCW9|A6TCW9_KLEP7 PTS family enzyme IIA, glucitol/sorbitol-specific OS=Klebsiella pneumoniae su",False
tr|A6TCX0|A6TCX0_KLEP7,srlD,259,unreviewed (tr),tr|A6TCX0|A6TCX0_KLEP7 Sorbitol-6-phosphate 2-dehydrogenase OS=Klebsiella pneumoniae subsp. pneumoni,False
tr|A6TCX1|A6TCX1_KLEP7,KPN_03041,97,unreviewed (tr),tr|A6TCX1|A6TCX1_KLEP7 Uncharacterized protein OS=Klebsiella pneumoniae subsp. pneumoniae (strain AT,False
tr|A6TCX2|A6TCX2_KLEP7,srlR,257,unreviewed (tr),"tr|A6TCX2|A6TCX2_KLEP7 Regulator for gut (Srl), glucitol operon OS=Klebsiella pneumoniae subsp. pneu",False
tr|A6TCX9|A6TCX9_KLEP7,hydN,175,unreviewed (tr),"tr|A6TCX9|A6TCX9_KLEP7 Electron transport protein (Formate to hydrogen), Fe-S center OS=Klebsiella p",False
tr|A6TCY0|A6TCY0_KLEP7,ascG,337,unreviewed (tr),tr|A6TCY0|A6TCY0_KLEP7 AscBF operon repressor OS=Klebsiella pneumoniae subsp. pneumoniae (strain ATC,False
tr|A6TCY2|A6TCY2_KLEP7,ascB,474,unreviewed (tr),tr|A6TCY2|A6TCY2_KLEP7 6-phospho-beta-glucosidase cryptic OS=Klebsiella pneumoniae subsp. pneumoniae,False
tr|A6TCY3|A6TCY3_KLEP7,KPN_03053,102,unreviewed (tr),tr|A6TCY3|A6TCY3_KLEP7 Toxin SymE-like domain-containing protein OS=Klebsiella pneumoniae subsp. pne,False
tr|A6TCY4|A6TCY4_KLEP7,hycI,145,unreviewed (tr),tr|A6TCY4|A6TCY4_KLEP7 Protease OS=Klebsiella pneumoniae subsp. pneumoniae (strain ATCC 700721 / MGH,False
tr|A6TCY5|A6TCY5_KLEP7,hycH,136,unreviewed (tr),tr|A6TCY5|A6TCY5_KLEP7 Processing of HycE (Part of the FHL complex) OS=Klebsiella pneumoniae subsp. ,False
tr|A6TCY7|A6TCY7_KLEP7,hycF,180,unreviewed (tr),tr|A6TCY7|A6TCY7_KLEP7 Hydrogenase 4 Fe-S subunit OS=Klebsiella pneumoniae subsp. pneumoniae (strain,False
tr|A6TCY9|A6TCY9_KLEP7,hycD,307,unreviewed (tr),"tr|A6TCY9|A6TCY9_KLEP7 Hydrogenase 3, membrane subunit (Part of FHL complex) OS=Klebsiella pneumonia",False
tr|A6TCZ0|A6TCZ0_KLEP7,hycC,608,unreviewed (tr),tr|A6TCZ0|A6TCZ0_KLEP7 NADH dehydrogenase subunit N OS=Klebsiella pneumoniae subsp. pneumoniae (stra,False
tr|A6TCZ2|A6TCZ2_KLEP7,hycA,149,unreviewed (tr),tr|A6TCZ2|A6TCZ2_KLEP7 HycE regulatory protein OS=Klebsiella pneumoniae subsp. pneumoniae (strain AT,False
tr|A6TCZ6|A6TCZ6_KLEP7,hypD,373,unreviewed (tr),tr|A6TCZ6|A6TCZ6_KLEP7 Hydrogenase maturation factor OS=Klebsiella pneumoniae subsp. pneumoniae (str,False
tr|A6TCZ7|A6TCZ7_KLEP7,hypE,336,unreviewed (tr),tr|A6TCZ7|A6TCZ7_KLEP7 Hydrogenase expression/formation protein HypE OS=Klebsiella pneumoniae subsp.,False
tr|A6TCZ8|A6TCZ8_KLEP7,fhlA,685,unreviewed (tr),tr|A6TCZ8|A6TCZ8_KLEP7 Formate hydrogen-lyase transcriptional activator OS=Klebsiella pneumoniae sub,False
tr|A6TCZ9|A6TCZ9_KLEP7,KPN_03069,466,unreviewed (tr),tr|A6TCZ9|A6TCZ9_KLEP7 Phospho-beta-glucosidase B cryptic OS=Klebsiella pneumoniae subsp. pneumoniae,False
tr|A6TD02|A6TD02_KLEP7,KPN_03072,450,unreviewed (tr),tr|A6TD02|A6TD02_KLEP7 Permease IIC component OS=Klebsiella pneumoniae subsp. pneumoniae (strain ATC,False
tr|A6TD03|A6TD03_KLEP7,KPN_03073,93,unreviewed (tr),tr|A6TD03|A6TD03_KLEP7 PEP-dependent phosphotransferase enzyme IV OS=Klebsiella pneumoniae subsp. pn,False
tr|A6TD04|A6TD04_KLEP7,KPN_03074,325,unreviewed (tr),tr|A6TD04|A6TD04_KLEP7 PEP-dependent phosphotransferase enzyme II OS=Klebsiella pneumoniae subsp. pn,False
tr|A6TD05|A6TD05_KLEP7,KPN_03075,104,unreviewed (tr),tr|A6TD05|A6TD05_KLEP7 PEP-dependent phosphotransferase enzyme III OS=Klebsiella pneumoniae subsp. p,False
tr|A6TD06|A6TD06_KLEP7,KPN_03076,304,unreviewed (tr),tr|A6TD06|A6TD06_KLEP7 Possible NAGC-like transcriptional regulator OS=Klebsiella pneumoniae subsp. ,False
tr|A6TD07|A6TD07_KLEP7,KPN_03077,320,unreviewed (tr),tr|A6TD07|A6TD07_KLEP7 Repressor of galETK operon OS=Klebsiella pneumoniae subsp. pneumoniae (strain,False
tr|A6TD08|A6TD08_KLEP7,sitA,305,unreviewed (tr),tr|A6TD08|A6TD08_KLEP7 Iron transporter: fur regulated OS=Klebsiella pneumoniae subsp. pneumoniae (s,False
tr|A6TD09|A6TD09_KLEP7,sitB,273,unreviewed (tr),tr|A6TD09|A6TD09_KLEP7 Iron transporter: fur regulated OS=Klebsiella pneumoniae subsp. pneumoniae (s,False
tr|A6TD12|A6TD12_KLEP7,ygbA,131,unreviewed (tr),tr|A6TD12|A6TD12_KLEP7 Nitrous oxide-stimulated promoter OS=Klebsiella pneumoniae subsp. pneumoniae ,False
tr|A6TD13|A6TD13_KLEP7,KPN_03083,293,unreviewed (tr),tr|A6TD13|A6TD13_KLEP7 Transcriptional regulator LYSR-type OS=Klebsiella pneumoniae subsp. pneumonia,False
tr|A6TD14|A6TD14_KLEP7,KPN_03084,313,unreviewed (tr),tr|A6TD14|A6TD14_KLEP7 Receptor protein OS=Klebsiella pneumoniae subsp. pneumoniae (strain ATCC 7007,False
tr|A6TD15|A6TD15_KLEP7,KPN_03085,569,unreviewed (tr),tr|A6TD15|A6TD15_KLEP7 Acetolactate synthase III large subunit OS=Klebsiella pneumoniae subsp. pneum,False
tr|A6TD16|A6TD16_KLEP7,KPN_03086,97,unreviewed (tr),tr|A6TD16|A6TD16_KLEP7 SelT/SelW/SelH family protein OS=Klebsiella pneumoniae subsp. pneumoniae (str,False
tr|A6TD17|A6TD17_KLEP7,KPN_03087,787,unreviewed (tr),"tr|A6TD17|A6TD17_KLEP7 Outer membrane porin, receptor for ferric enterobactin and colicins B and D O",False
tr|A6TD18|A6TD18_KLEP7,KPN_03088,345,unreviewed (tr),tr|A6TD18|A6TD18_KLEP7 S-adenosylmethionine-dependent methyltransferase OS=Klebsiella pneumoniae sub,False
tr|A6TD19|A6TD19_KLEP7,KPN_03089,272,unreviewed (tr),tr|A6TD19|A6TD19_KLEP7 Vitamin B12-transporter protein BtuF OS=Klebsiella pneumoniae subsp. pneumoni,False
tr|A6TD20|A6TD20_KLEP7,KPN_03090,331,unreviewed (tr),tr|A6TD20|A6TD20_KLEP7 Vtamin B12-transporter permease OS=Klebsiella pneumoniae subsp. pneumoniae (s,False
tr|A6TD21|A6TD21_KLEP7,KPN_03091,259,unreviewed (tr),tr|A6TD21|A6TD21_KLEP7 ATP-binding component of hydroxymate-dependent iron transport OS=Klebsiella p,False
tr|A6TD22|A6TD22_KLEP7,KPN_03092,160,unreviewed (tr),tr|A6TD22|A6TD22_KLEP7 Aminoacyl-histidine dipeptidase (Peptidase D) OS=Klebsiella pneumoniae subsp.,False
tr|A6TD23|A6TD23_KLEP7,KPN_03093,110,unreviewed (tr),tr|A6TD23|A6TD23_KLEP7 Tagaturonate reductase OS=Klebsiella pneumoniae subsp. pneumoniae (strain ATC,False
tr|A6TD25|A6TD25_KLEP7,KPN_03095,67,unreviewed (tr),tr|A6TD25|A6TD25_KLEP7 Small toxic membrane polypeptide OS=Klebsiella pneumoniae subsp. pneumoniae (,False
tr|A6TD26|A6TD26_KLEP7,KPN_03096,78,unreviewed (tr),tr|A6TD26|A6TD26_KLEP7 Cytoplasmic protein OS=Klebsiella pneumoniae subsp. pneumoniae (strain ATCC 7,False
tr|A6TD29|A6TD29_KLEP7,KPN_03099,135,unreviewed (tr),tr|A6TD29|A6TD29_KLEP7 Transcriptional regulator OS=Klebsiella pneumoniae subsp. pneumoniae (strain ,False
tr|A6TD30|A6TD30_KLEP7,KPN_03100,295,unreviewed (tr),"tr|A6TD30|A6TD30_KLEP7 Transcriptional regulators, LysR family OS=Klebsiella pneumoniae subsp. pneum",False
tr|A6TD31|A6TD31_KLEP7,KPN_03101,400,unreviewed (tr),tr|A6TD31|A6TD31_KLEP7 Permease OS=Klebsiella pneumoniae subsp. pneumoniae (strain ATCC 700721 / MGH,False
tr|A6TD32|A6TD32_KLEP7,KPN_03102,125,unreviewed (tr),tr|A6TD32|A6TD32_KLEP7 Cytoplasmic protein OS=Klebsiella pneumoniae subsp. pneumoniae (strain ATCC 7,False
tr|A6TD41|A6TD41_KLEP7,ygbE,108,unreviewed (tr),tr|A6TD41|A6TD41_KLEP7 Cytochrome oxidase subunit OS=Klebsiella pneumoniae subsp. pneumoniae (strain,False
tr|A6TD46|A6TD46_KLEP7,iap,348,unreviewed (tr),tr|A6TD46|A6TD46_KLEP7 Alkaline phosphatase isozyme conversion protein aminopeptidase OS=Klebsiella ,False
tr|A6TD52|A6TD52_KLEP7,KPN_03122,369,unreviewed (tr),tr|A6TD52|A6TD52_KLEP7 Hemolysin F OS=Klebsiella pneumoniae subsp. pneumoniae (strain ATCC 700721 / ,False
tr|A6TD59|A6TD59_KLEP7,garK,379,unreviewed (tr),tr|A6TD59|A6TD59_KLEP7 Glycerate kinase I OS=Klebsiella pneumoniae subsp. pneumoniae (strain ATCC 70,False
tr|A6TD61|A6TD61_KLEP7,gudX,435,unreviewed (tr),tr|A6TD61|A6TD61_KLEP7 (D)-glucarate dehydratase 2 OS=Klebsiella pneumoniae subsp. pneumoniae (strai,False
tr|A6TD62|A6TD62_KLEP7,gudP,450,unreviewed (tr),tr|A6TD62|A6TD62_KLEP7 D-glucarate permease (MFS family) OS=Klebsiella pneumoniae subsp. pneumoniae ,False
tr|A6TD63|A6TD63_KLEP7,yqcA,147,unreviewed (tr),tr|A6TD63|A6TD63_KLEP7 Flavodoxin OS=Klebsiella pneumoniae subsp. pneumoniae (strain ATCC 700721 / M,False
tr|A6TD65|A6TD65_KLEP7,yqcC,109,unreviewed (tr),tr|A6TD65|A6TD65_KLEP7 YqcC-like domain-containing protein OS=Klebsiella pneumoniae subsp. pneumonia,False
sp|A6TD66|SYDP_KLEP7,syd,181,reviewed (sp),sp|A6TD66|SYDP_KLEP7 Protein Syd OS=Klebsiella pneumoniae subsp. pneumoniae (strain ATCC 700721 / MG,False
tr|A6TD69|A6TD69_KLEP7,sdaC,429,unreviewed (tr),tr|A6TD69|A6TD69_KLEP7 Probable serine transporter OS=Klebsiella pneumoniae subsp. pneumoniae (strai,False
tr|A6TD72|A6TD72_KLEP7,KPN_03142,473,unreviewed (tr),tr|A6TD72|A6TD72_KLEP7 General substrate transporter OS=Klebsiella pneumoniae subsp. pneumoniae (str,False
tr|A6TD73|A6TD73_KLEP7,KPN_03143,292,unreviewed (tr),"tr|A6TD73|A6TD73_KLEP7 ABC-type metal ion transport system, periplasmic component/surface antigen OS",False
tr|A6TD74|A6TD74_KLEP7,KPN_03144,232,unreviewed (tr),"tr|A6TD74|A6TD74_KLEP7 ABC-type metal ion transport system, permease component OS=Klebsiella pneumon",False
tr|A6TD75|A6TD75_KLEP7,KPN_03145,196,unreviewed (tr),"tr|A6TD75|A6TD75_KLEP7 D-and L-methionine transport protein (ABC superfamily, atp_bind) OS=Klebsiell",False
tr|A6TD76|A6TD76_KLEP7,KPN_03146,465,unreviewed (tr),tr|A6TD76|A6TD76_KLEP7 Oxidoreductase OS=Klebsiella pneumoniae subsp. pneumoniae (strain ATCC 700721,False
tr|A6TD78|A6TD78_KLEP7,KPN_03148,647,unreviewed (tr),tr|A6TD78|A6TD78_KLEP7 Transcriptional regulator OS=Klebsiella pneumoniae subsp. pneumoniae (strain ,False
tr|A6TD80|A6TD80_KLEP7,fucO,378,unreviewed (tr),"tr|A6TD80|A6TD80_KLEP7 L-1,2-propanediol oxidoreductase OS=Klebsiella pneumoniae subsp. pneumoniae (",False
tr|A6TD82|A6TD82_KLEP7,fucP,423,unreviewed (tr),tr|A6TD82|A6TD82_KLEP7 Fucose permease OS=Klebsiella pneumoniae subsp. pneumoniae (strain ATCC 70072,False
tr|A6TD86|A6TD86_KLEP7,fucR,236,unreviewed (tr),tr|A6TD86|A6TD86_KLEP7 Positive regulator of the fuc operon OS=Klebsiella pneumoniae subsp. pneumoni,False
tr|A6TD88|A6TD88_KLEP7,ygdD,131,unreviewed (tr),tr|A6TD88|A6TD88_KLEP7 DUF423 domain-containing protein OS=Klebsiella pneumoniae subsp. pneumoniae (,False
tr|A6TD90|A6TD90_KLEP7,ygdI,76,unreviewed (tr),tr|A6TD90|A6TD90_KLEP7 Lipoprotein YgdI/YgdR-like SH3-like domain-containing protein OS=Klebsiella p,False
tr|A6TD92|A6TD92_KLEP7,ygdK,143,unreviewed (tr),tr|A6TD92|A6TD92_KLEP7 Fe-S metabolism associated domain-containing protein OS=Klebsiella pneumoniae,False
tr|A6TD95|A6TD95_KLEP7,KPN_03168,446,unreviewed (tr),tr|A6TD95|A6TD95_KLEP7 Type VI secretion system baseplate subunit TssK OS=Klebsiella pneumoniae subs,False
tr|A6TD96|A6TD96_KLEP7,KPN_03169,567,unreviewed (tr),tr|A6TD96|A6TD96_KLEP7 OmpA-like domain-containing protein OS=Klebsiella pneumoniae subsp. pneumonia,False
tr|A6TD97|A6TD97_KLEP7,KPN_03170,851,unreviewed (tr),tr|A6TD97|A6TD97_KLEP7 Type VI secretion system tip protein VgrG OS=Klebsiella pneumoniae subsp. pne,False
tr|A6TD98|A6TD98_KLEP7,KPN_03171,483,unreviewed (tr),tr|A6TD98|A6TD98_KLEP7 Uncharacterized protein OS=Klebsiella pneumoniae subsp. pneumoniae (strain AT,False
tr|A6TD99|A6TD99_KLEP7,KPN_03172,342,unreviewed (tr),tr|A6TD99|A6TD99_KLEP7 Uncharacterized protein OS=Klebsiella pneumoniae subsp. pneumoniae (strain AT,False
tr|A6TDA0|A6TDA0_KLEP7,KPN_03173,123,unreviewed (tr),tr|A6TDA0|A6TDA0_KLEP7 Uncharacterized protein OS=Klebsiella pneumoniae subsp. pneumoniae (strain AT,False
tr|A6TDA1|A6TDA1_KLEP7,KPN_03174,379,unreviewed (tr),tr|A6TDA1|A6TDA1_KLEP7 Type VI secretion protein OS=Klebsiella pneumoniae subsp. pneumoniae (strain ,False
tr|A6TDA2|A6TDA2_KLEP7,KPN_03175,1025,unreviewed (tr),tr|A6TDA2|A6TDA2_KLEP7 Type VI secretion protein VasK OS=Klebsiella pneumoniae subsp. pneumoniae (st,False
tr|A6TDA3|A6TDA3_KLEP7,KPN_03176,130,unreviewed (tr),tr|A6TDA3|A6TDA3_KLEP7 Type VI secretion protein OS=Klebsiella pneumoniae subsp. pneumoniae (strain ,False
tr|A6TDA4|A6TDA4_KLEP7,KPN_03177,320,unreviewed (tr),tr|A6TDA4|A6TDA4_KLEP7 Uncharacterized protein OS=Klebsiella pneumoniae subsp. pneumoniae (strain AT,False
tr|A6TDA5|A6TDA5_KLEP7,KPN_03178,198,unreviewed (tr),tr|A6TDA5|A6TDA5_KLEP7 Uncharacterized protein OS=Klebsiella pneumoniae subsp. pneumoniae (strain AT,False
tr|A6TDA6|A6TDA6_KLEP7,KPN_03179,586,unreviewed (tr),tr|A6TDA6|A6TDA6_KLEP7 Type VI secretion system baseplate subunit TssF OS=Klebsiella pneumoniae subs,False
tr|A6TDA7|A6TDA7_KLEP7,KPN_03180,360,unreviewed (tr),tr|A6TDA7|A6TDA7_KLEP7 Type VI secretion system baseplate subunit TssG OS=Klebsiella pneumoniae subs,False
tr|A6TDA8|A6TDA8_KLEP7,KPN_03181,141,unreviewed (tr),tr|A6TDA8|A6TDA8_KLEP7 IraD/Gp25-like domain-containing protein OS=Klebsiella pneumoniae subsp. pneu,False
tr|A6TDB3|A6TDB3_KLEP7,cboQ,225,unreviewed (tr),tr|A6TDB3|A6TDB3_KLEP7 Energy-coupling factor ABC transporter transmembrane protein OS=Klebsiella pn,False
tr|A6TDB8|A6TDB8_KLEP7,cbiJ,261,unreviewed (tr),tr|A6TDB8|A6TDB8_KLEP7 Cobalt-precorrin-6A reductase OS=Klebsiella pneumoniae subsp. pneumoniae (str,False
tr|A6TDB9|A6TDB9_KLEP7,cbiH,241,unreviewed (tr),tr|A6TDB9|A6TDB9_KLEP7 Tetrapyrrole methylase domain-containing protein OS=Klebsiella pneumoniae sub,False
tr|A6TDC0|A6TDC0_KLEP7,cbiG,351,unreviewed (tr),tr|A6TDC0|A6TDC0_KLEP7 Cobalt-precorrin 5A hydrolase OS=Klebsiella pneumoniae subsp. pneumoniae (str,False
tr|A6TDC2|A6TDC2_KLEP7,cbiT,189,unreviewed (tr),tr|A6TDC2|A6TDC2_KLEP7 Methyltransferase domain-containing protein OS=Klebsiella pneumoniae subsp. p,False
tr|A6TDC3|A6TDC3_KLEP7,cbiE,201,unreviewed (tr),tr|A6TDC3|A6TDC3_KLEP7 Tetrapyrrole methylase domain-containing protein OS=Klebsiella pneumoniae sub,False
tr|A6TDC5|A6TDC5_KLEP7,cbiC,211,unreviewed (tr),tr|A6TDC5|A6TDC5_KLEP7 Cobalamin biosynthesis precorrin-8X methylmutase CobH/CbiC domain-containing ,False
tr|A6TDC8|A6TDC8_KLEP7,pocR,303,unreviewed (tr),tr|A6TDC8|A6TDC8_KLEP7 HTH araC/xylS-type domain-containing protein OS=Klebsiella pneumoniae subsp. ,False
tr|A6TDC9|A6TDC9_KLEP7,pduF,269,unreviewed (tr),tr|A6TDC9|A6TDC9_KLEP7 Propanediol utilization: propanediol diffusion facilitator OS=Klebsiella pneu,False
tr|A6TDD0|A6TDD0_KLEP7,pduA,94,unreviewed (tr),tr|A6TDD0|A6TDD0_KLEP7 Bacterial microcompartment protein homohexamer OS=Klebsiella pneumoniae subsp,False
tr|A6TDD1|A6TDD1_KLEP7,pudB,270,unreviewed (tr),tr|A6TDD1|A6TDD1_KLEP7 Propanediol utilization: polyhedral bodies OS=Klebsiella pneumoniae subsp. pn,False
tr|A6TDD2|A6TDD2_KLEP7,pduC,554,unreviewed (tr),"tr|A6TDD2|A6TDD2_KLEP7 Propanediol utilization: dehydratase, large subunit OS=Klebsiella pneumoniae ",False
tr|A6TDD3|A6TDD3_KLEP7,pduD,229,unreviewed (tr),"tr|A6TDD3|A6TDD3_KLEP7 Propanediol utilization: dehydratase, medium subunit OS=Klebsiella pneumoniae",False
tr|A6TDD4|A6TDD4_KLEP7,pduE,174,unreviewed (tr),"tr|A6TDD4|A6TDD4_KLEP7 Propanediol utilization: dehydratase, small subunit OS=Klebsiella pneumoniae ",False
tr|A6TDD5|A6TDD5_KLEP7,pduG,610,unreviewed (tr),tr|A6TDD5|A6TDD5_KLEP7 Propanediol utilization: diol dehydratase reactivation OS=Klebsiella pneumoni,False
tr|A6TDD6|A6TDD6_KLEP7,pduH,116,unreviewed (tr),tr|A6TDD6|A6TDD6_KLEP7 Propanediol utilization: diol dehydratase reactivation OS=Klebsiella pneumoni,False
tr|A6TDD7|A6TDD7_KLEP7,pduJ,91,unreviewed (tr),tr|A6TDD7|A6TDD7_KLEP7 Bacterial microcompartment protein homohexamer OS=Klebsiella pneumoniae subsp,False
tr|A6TDD8|A6TDD8_KLEP7,pduK,148,unreviewed (tr),tr|A6TDD8|A6TDD8_KLEP7 Propanediol utilization: polyhedral bodies OS=Klebsiella pneumoniae subsp. pn,False
tr|A6TDE0|A6TDE0_KLEP7,pduM,163,unreviewed (tr),tr|A6TDE0|A6TDE0_KLEP7 Propanediol utilization OS=Klebsiella pneumoniae subsp. pneumoniae (strain AT,False
tr|A6TDE1|A6TDE1_KLEP7,pduN,91,unreviewed (tr),tr|A6TDE1|A6TDE1_KLEP7 Propanediol utilization: polyhedral bodies OS=Klebsiella pneumoniae subsp. pn,False
tr|A6TDE2|A6TDE2_KLEP7,pduO,338,unreviewed (tr),tr|A6TDE2|A6TDE2_KLEP7 Propanediol utilization: B12 related OS=Klebsiella pneumoniae subsp. pneumoni,False
tr|A6TDE3|A6TDE3_KLEP7,pduP,462,unreviewed (tr),tr|A6TDE3|A6TDE3_KLEP7 Propanediol utilization: CoA-dependent propionaldehyde dehydrogenase OS=Klebs,False
tr|A6TDE4|A6TDE4_KLEP7,pduQ,370,unreviewed (tr),tr|A6TDE4|A6TDE4_KLEP7 Propanediol utilization: propanol dehydrogenase OS=Klebsiella pneumoniae subs,False
tr|A6TDE5|A6TDE5_KLEP7,pduS,450,unreviewed (tr),tr|A6TDE5|A6TDE5_KLEP7 Propanediol utilization: polyhedral bodies OS=Klebsiella pneumoniae subsp. pn,False
tr|A6TDE6|A6TDE6_KLEP7,pduT,184,unreviewed (tr),tr|A6TDE6|A6TDE6_KLEP7 Propanediol utilization: polyhedral bodies OS=Klebsiella pneumoniae subsp. pn,False
tr|A6TDE7|A6TDE7_KLEP7,pduU,116,unreviewed (tr),tr|A6TDE7|A6TDE7_KLEP7 Propanediol utilization: polyhedral bodies OS=Klebsiella pneumoniae subsp. pn,False
tr|A6TDE8|A6TDE8_KLEP7,pduV,146,unreviewed (tr),tr|A6TDE8|A6TDE8_KLEP7 Propanediol utilization OS=Klebsiella pneumoniae subsp. pneumoniae (strain AT,False
tr|A6TDF4|A6TDF4_KLEP7,KPN_03227,106,unreviewed (tr),tr|A6TDF4|A6TDF4_KLEP7 Uncharacterized protein OS=Klebsiella pneumoniae subsp. pneumoniae (strain AT,False
tr|A6TDF9|A6TDF9_KLEP7,ppdC,107,unreviewed (tr),tr|A6TDF9|A6TDF9_KLEP7 Prepilin peptidase dependent protein C OS=Klebsiella pneumoniae subsp. pneumo,False
tr|A6TDG0|A6TDG0_KLEP7,ygdB,129,unreviewed (tr),tr|A6TDG0|A6TDG0_KLEP7 DUF2509 family protein OS=Klebsiella pneumoniae subsp. pneumoniae (strain ATC,False
tr|A6TDG1|A6TDG1_KLEP7,ppdB,185,unreviewed (tr),tr|A6TDG1|A6TDG1_KLEP7 Prepilin peptidase dependent protein B OS=Klebsiella pneumoniae subsp. pneumo,False
tr|A6TDG2|A6TDG2_KLEP7,ppdA,183,unreviewed (tr),tr|A6TDG2|A6TDG2_KLEP7 Prepilin peptidase dependent protein A OS=Klebsiella pneumoniae subsp. pneumo,False
tr|A6TDG8|A6TDG8_KLEP7,ygdQ,237,unreviewed (tr),"tr|A6TDG8|A6TDG8_KLEP7 Transmembrane protein, transport OS=Klebsiella pneumoniae subsp. pneumoniae (",False
