uniprot_id,gene_name,length,entry_type,description,is_essential
tr|A6TBI0|A6TBI0_KLEP7,yegS,298,unreviewed (tr),tr|A6TBI0|A6TBI0_KLEP7 Probable lipid kinase YegS-like OS=Klebsiella pneumoniae subsp. pneumoniae (s,False
tr|A6TBI2|A6TBI2_KLEP7,KPN_02535,280,unreviewed (tr),tr|A6TBI2|A6TBI2_KLEP7 ABC-type dipeptide transporter OS=Klebsiella pneumoniae subsp. pneumoniae (st,False
tr|A6TBI9|A6TBI9_KLEP7,xylB,487,unreviewed (tr),tr|A6TBI9|A6TBI9_KLEP7 Xylulose kinase OS=Klebsiella pneumoniae subsp. pneumoniae (strain ATCC 70072,False
tr|A6TBJ6|A6TBJ6_KLEP7,fbaB,350,unreviewed (tr),tr|A6TBJ6|A6TBJ6_KLEP7 Fructose-bisphosphate aldolase class 1 OS=Klebsiella pneumoniae subsp. pneumo,False
tr|A6TBJ7|A6TBJ7_KLEP7,thiD,266,unreviewed (tr),tr|A6TBJ7|A6TBJ7_KLEP7 hydroxymethylpyrimidine kinase OS=Klebsiella pneumoniae subsp. pneumoniae (st,False
sp|A6TBK1|ADEC_KLEP7,ade,603,reviewed (sp),sp|A6TBK1|ADEC_KLEP7 Adenine deaminase OS=Klebsiella pneumoniae subsp. pneumoniae (strain ATCC 70072,False
tr|A6TBK6|A6TBK6_KLEP7,mrp,354,unreviewed (tr),tr|A6TBK6|A6TBK6_KLEP7 Iron-sulfur cluster carrier protein OS=Klebsiella pneumoniae subsp. pneumonia,False
tr|A6TBL0|A6TBL0_KLEP7,yehU,574,unreviewed (tr),tr|A6TBL0|A6TBL0_KLEP7 Sensor histidine kinase BtsS OS=Klebsiella pneumoniae subsp. pneumoniae (stra,False
tr|A6TBL5|A6TBL5_KLEP7,bglX,765,unreviewed (tr),tr|A6TBL5|A6TBL5_KLEP7 Periplasmic beta-glucosidase OS=Klebsiella pneumoniae subsp. pneumoniae (stra,False
tr|A6TBM0|A6TBM0_KLEP7,pbpG,316,unreviewed (tr),tr|A6TBM0|A6TBM0_KLEP7 D-alanyl-D-alanine endopeptidase penicillin-binding proteins 7 and 8 OS=Klebs,False
tr|A6TBM5|A6TBM5_KLEP7,KPN_02578,620,unreviewed (tr),tr|A6TBM5|A6TBM5_KLEP7 Cellobiose-specific PTS permease OS=Klebsiella pneumoniae subsp. pneumoniae (,False
tr|A6TBN4|A6TBN4_KLEP7,mglA,491,unreviewed (tr),tr|A6TBN4|A6TBN4_KLEP7 Ribose/galactose/methyl galactoside import ATP-binding protein OS=Klebsiella ,False
tr|A6TBN5|A6TBN5_KLEP7,mglB,342,unreviewed (tr),tr|A6TBN5|A6TBN5_KLEP7 D-galactose/methyl-galactoside binding periplasmic protein MglB OS=Klebsiella,False
tr|A6TBN9|A6TBN9_KLEP7,yeiG,277,unreviewed (tr),tr|A6TBN9|A6TBN9_KLEP7 S-formylglutathione hydrolase OS=Klebsiella pneumoniae subsp. pneumoniae (str,False
tr|A6TBP6|A6TBP6_KLEP7,fruK,312,unreviewed (tr),tr|A6TBP6|A6TBP6_KLEP7 Phosphofructokinase OS=Klebsiella pneumoniae subsp. pneumoniae (strain ATCC 7,False
tr|A6TBP7|A6TBP7_KLEP7,fruB,376,unreviewed (tr),tr|A6TBP7|A6TBP7_KLEP7 Multiphosphoryl transfer protein OS=Klebsiella pneumoniae subsp. pneumoniae (,False
tr|A6TBP8|A6TBP8_KLEP7,setB,393,unreviewed (tr),tr|A6TBP8|A6TBP8_KLEP7 Lactose/glucose:proton efflux pump (MFS family) OS=Klebsiella pneumoniae subs,False
sp|A6TBQ0|EFPL_KLEP7,efpL,190,reviewed (sp),sp|A6TBQ0|EFPL_KLEP7 Elongation factor protein EfpL OS=Klebsiella pneumoniae subsp. pneumoniae (stra,False
tr|A6TBQ1|A6TBQ1_KLEP7,uxuA,396,unreviewed (tr),tr|A6TBQ1|A6TBQ1_KLEP7 Mannonate dehydratase OS=Klebsiella pneumoniae subsp. pneumoniae (strain ATCC,False
tr|A6TBQ6|A6TBQ6_KLEP7,rtn,520,unreviewed (tr),tr|A6TBQ6|A6TBQ6_KLEP7 cyclic-guanylate-specific phosphodiesterase OS=Klebsiella pneumoniae subsp. p,False
tr|A6TBQ8|A6TBQ8_KLEP7,yejB,364,unreviewed (tr),tr|A6TBQ8|A6TBQ8_KLEP7 Inner membrane ABC transporter permease protein YejB OS=Klebsiella pneumoniae,False
tr|A6TBR2|A6TBR2_KLEP7,bcr,398,unreviewed (tr),tr|A6TBR2|A6TBR2_KLEP7 Bcr/CflA family efflux transporter OS=Klebsiella pneumoniae subsp. pneumoniae,False
tr|A6TBR3|A6TBR3_KLEP7,rsuA,239,unreviewed (tr),tr|A6TBR3|A6TBR3_KLEP7 Pseudouridine synthase OS=Klebsiella pneumoniae subsp. pneumoniae (strain ATC,False
sp|A6TBR5|RL25_KLEP7,rplY,94,reviewed (sp),sp|A6TBR5|RL25_KLEP7 Large ribosomal subunit protein bL25 OS=Klebsiella pneumoniae subsp. pneumoniae,True
tr|A6TBR8|A6TBR8_KLEP7,KPN_02621,198,unreviewed (tr),tr|A6TBR8|A6TBR8_KLEP7 GDP-mannose pyrophosphatase OS=Klebsiella pneumoniae subsp. pneumoniae (strai,False
tr|A6TBS4|A6TBS4_KLEP7,eco,147,unreviewed (tr),tr|A6TBS4|A6TBS4_KLEP7 Ecotin OS=Klebsiella pneumoniae subsp. pneumoniae (strain ATCC 700721 / MGH 7,False
tr|A6TBS5|A6TBS5_KLEP7,mqo,544,unreviewed (tr),tr|A6TBS5|A6TBS5_KLEP7 Probable malate:quinone oxidoreductase OS=Klebsiella pneumoniae subsp. pneumo,False
tr|A6TBS7|A6TBS7_KLEP7,KPN_02631,478,unreviewed (tr),tr|A6TBS7|A6TBS7_KLEP7 Magnesium transporter MgtE OS=Klebsiella pneumoniae subsp. pneumoniae (strain,False
tr|A6TBS8|A6TBS8_KLEP7,yojI,547,unreviewed (tr),tr|A6TBS8|A6TBS8_KLEP7 ATP-binding component of a transport system OS=Klebsiella pneumoniae subsp. p,False
tr|A6TBT0|A6TBT0_KLEP7,ada,354,unreviewed (tr),tr|A6TBT0|A6TBT0_KLEP7 Regulatory protein of adaptive response OS=Klebsiella pneumoniae subsp. pneum,False
tr|A6TBT1|A6TBT1_KLEP7,yojL,350,unreviewed (tr),tr|A6TBT1|A6TBT1_KLEP7 FAD:protein FMN transferase OS=Klebsiella pneumoniae subsp. pneumoniae (strai,False
tr|A6TBT2|A6TBT2_KLEP7,ompC,367,unreviewed (tr),tr|A6TBT2|A6TBT2_KLEP7 Outer membrane pore protein 1b (Ibc) OS=Klebsiella pneumoniae subsp. pneumoni,False
tr|A6TBT4|A6TBT4_KLEP7,rcsB,216,unreviewed (tr),tr|A6TBT4|A6TBT4_KLEP7 Transcriptional regulatory protein RcsB OS=Klebsiella pneumoniae subsp. pneum,False
tr|A6TBT8|A6TBT8_KLEP7,nrdA,761,unreviewed (tr),tr|A6TBT8|A6TBT8_KLEP7 Ribonucleoside-diphosphate reductase OS=Klebsiella pneumoniae subsp. pneumoni,False
tr|A6TBT9|A6TBT9_KLEP7,nrdB,376,unreviewed (tr),tr|A6TBT9|A6TBT9_KLEP7 Ribonucleoside-diphosphate reductase 1 subunit beta OS=Klebsiella pneumoniae ,False
tr|A6TBU1|A6TBU1_KLEP7,glpQ,356,unreviewed (tr),tr|A6TBU1|A6TBU1_KLEP7 glycerophosphodiester phosphodiesterase OS=Klebsiella pneumoniae subsp. pneum,False
tr|A6TBU2|A6TBU2_KLEP7,glpT,448,unreviewed (tr),tr|A6TBU2|A6TBU2_KLEP7 Glycerol-3-phosphate transporter OS=Klebsiella pneumoniae subsp. pneumoniae (,False
sp|A6TBU4|GLPB_KLEP7,glpB,419,reviewed (sp),sp|A6TBU4|GLPB_KLEP7 Anaerobic glycerol-3-phosphate dehydrogenase subunit B OS=Klebsiella pneumoniae,False
tr|A6TBU5|A6TBU5_KLEP7,glpC,392,unreviewed (tr),tr|A6TBU5|A6TBU5_KLEP7 Anaerobic glycerol-3-phosphate dehydrogenase subunit C OS=Klebsiella pneumoni,False
sp|A6TBV7|MENH_KLEP7,menH,252,reviewed (sp),"sp|A6TBV7|MENH_KLEP7 2-succinyl-6-hydroxy-2,4-cyclohexadiene-1-carboxylate synthase OS=Klebsiella pn",False
tr|A6TBW3|A6TBW3_KLEP7,nuoM,509,unreviewed (tr),tr|A6TBW3|A6TBW3_KLEP7 NADH-quinone oxidoreductase subunit M OS=Klebsiella pneumoniae subsp. pneumon,False
tr|A6TBW6|A6TBW6_KLEP7,nuoJ,184,unreviewed (tr),tr|A6TBW6|A6TBW6_KLEP7 NADH-quinone oxidoreductase subunit J OS=Klebsiella pneumoniae subsp. pneumon,False
tr|A6TBX0|A6TBX0_KLEP7,nuoF,445,unreviewed (tr),tr|A6TBX0|A6TBX0_KLEP7 NADH-quinone oxidoreductase subunit F OS=Klebsiella pneumoniae subsp. pneumon,False
tr|A6TBX1|A6TBX1_KLEP7,nuoE,166,unreviewed (tr),tr|A6TBX1|A6TBX1_KLEP7 NADH-quinone oxidoreductase subunit E OS=Klebsiella pneumoniae subsp. pneumon,False
tr|A6TBX6|A6TBX6_KLEP7,yfbQ,405,unreviewed (tr),tr|A6TBX6|A6TBX6_KLEP7 Glutamate-pyruvate aminotransferase AlaA OS=Klebsiella pneumoniae subsp. pneu,False
tr|A6TBX8|A6TBX8_KLEP7,yfbS,610,unreviewed (tr),tr|A6TBX8|A6TBX8_KLEP7 Uncharacterized transporter YfbS OS=Klebsiella pneumoniae subsp. pneumoniae (,False
tr|A6TBY4|A6TBY4_KLEP7,pta,710,unreviewed (tr),tr|A6TBY4|A6TBY4_KLEP7 Phosphate acetyltransferase OS=Klebsiella pneumoniae subsp. pneumoniae (strai,False
tr|A6TBY5|A6TBY5_KLEP7,yfcD,183,unreviewed (tr),tr|A6TBY5|A6TBY5_KLEP7 Uncharacterized Nudix hydrolase YfcD OS=Klebsiella pneumoniae subsp. pneumoni,False
tr|A6TBY9|A6TBY9_KLEP7,folX,120,unreviewed (tr),tr|A6TBY9|A6TBY9_KLEP7 Dihydroneopterin triphosphate 2'-epimerase OS=Klebsiella pneumoniae subsp. pn,False
tr|A6TBZ3|A6TBZ3_KLEP7,hisM,238,unreviewed (tr),tr|A6TBZ3|A6TBZ3_KLEP7 Histidine/lysine/arginine/ornithine transport system permease protein HisM OS,False
tr|A6TBZ4|A6TBZ4_KLEP7,hisQ,228,unreviewed (tr),tr|A6TBZ4|A6TBZ4_KLEP7 Histidine/lysine/arginine/ornithine transport system permease protein HisQ OS,False
tr|A6TBZ7|A6TBZ7_KLEP7,ubiX,189,unreviewed (tr),tr|A6TBZ7|A6TBZ7_KLEP7 Flavin prenyltransferase UbiX OS=Klebsiella pneumoniae subsp. pneumoniae (str,False
tr|A6TC00|A6TC00_KLEP7,dedD,229,unreviewed (tr),tr|A6TC00|A6TC00_KLEP7 Cell division protein DedD OS=Klebsiella pneumoniae subsp. pneumoniae (strain,False
tr|A6TC08|A6TC08_KLEP7,yfcJ,363,unreviewed (tr),tr|A6TC08|A6TC08_KLEP7 Uncharacterized MFS-type transporter KPN_02712 OS=Klebsiella pneumoniae subsp,False
tr|A6TC09|A6TC09_KLEP7,fabB,406,unreviewed (tr),tr|A6TC09|A6TC09_KLEP7 3-oxoacyl-[acyl-carrier-protein] synthase 1 OS=Klebsiella pneumoniae subsp. p,True
tr|A6TC16|A6TC16_KLEP7,yfcB,334,unreviewed (tr),tr|A6TC16|A6TC16_KLEP7 Ribosomal protein uL3 glutamine methyltransferase OS=Klebsiella pneumoniae su,False
sp|A6TC17|SMRB_KLEP7,smrB,183,reviewed (sp),sp|A6TC17|SMRB_KLEP7 Ribosome rescue factor SmrB OS=Klebsiella pneumoniae subsp. pneumoniae (strain ,False
tr|A6TC22|A6TC22_KLEP7,fadL,442,unreviewed (tr),tr|A6TC22|A6TC22_KLEP7 Long-chain fatty acid transport protein OS=Klebsiella pneumoniae subsp. pneum,False
tr|A6TC31|A6TC31_KLEP7,ypdA,565,unreviewed (tr),tr|A6TC31|A6TC31_KLEP7 histidine kinase OS=Klebsiella pneumoniae subsp. pneumoniae (strain ATCC 7007,False
sp|A6TC33|GLK_KLEP7,glk,321,reviewed (sp),sp|A6TC33|GLK_KLEP7 Glucokinase OS=Klebsiella pneumoniae subsp. pneumoniae (strain ATCC 700721 / MGH,False
tr|A6TC34|A6TC34_KLEP7,yfeO,403,unreviewed (tr),tr|A6TC34|A6TC34_KLEP7 Putative ion-transport protein KPN_02739 OS=Klebsiella pneumoniae subsp. pneu,False
tr|A6TC35|A6TC35_KLEP7,KPN_02740,555,unreviewed (tr),tr|A6TC35|A6TC35_KLEP7 Pyruvate decarboxylase OS=Klebsiella pneumoniae subsp. pneumoniae (strain ATC,False
sp|A6TC38|MNTH_KLEP7,mntH,413,reviewed (sp),sp|A6TC38|MNTH_KLEP7 Divalent metal cation transporter MntH OS=Klebsiella pneumoniae subsp. pneumoni,False
tr|A6TC39|A6TC39_KLEP7,nupC,400,unreviewed (tr),tr|A6TC39|A6TC39_KLEP7 Nucleoside permease OS=Klebsiella pneumoniae subsp. pneumoniae (strain ATCC 7,False
sp|A6TC48|ZIPA_KLEP7,zipA,353,reviewed (sp),sp|A6TC48|ZIPA_KLEP7 Cell division protein ZipA OS=Klebsiella pneumoniae subsp. pneumoniae (strain A,False
tr|A6TC49|A6TC49_KLEP7,cysZ,253,unreviewed (tr),tr|A6TC49|A6TC49_KLEP7 Sulfate transporter CysZ OS=Klebsiella pneumoniae subsp. pneumoniae (strain A,False
tr|A6TC50|A6TC50_KLEP7,cysK,323,unreviewed (tr),tr|A6TC50|A6TC50_KLEP7 Cysteine synthase OS=Klebsiella pneumoniae subsp. pneumoniae (strain ATCC 700,False
tr|A6TC53|A6TC53_KLEP7,crr,169,unreviewed (tr),tr|A6TC53|A6TC53_KLEP7 PTS system glucose-specific EIIA component OS=Klebsiella pneumoniae subsp. pn,False
tr|A6TC55|A6TC55_KLEP7,pdxK,288,unreviewed (tr),tr|A6TC55|A6TC55_KLEP7 pyridoxal kinase OS=Klebsiella pneumoniae subsp. pneumoniae (strain ATCC 7007,False
tr|A6TC58|A6TC58_KLEP7,cysM,303,unreviewed (tr),tr|A6TC58|A6TC58_KLEP7 Cysteine synthase OS=Klebsiella pneumoniae subsp. pneumoniae (strain ATCC 700,False
tr|A6TC60|A6TC60_KLEP7,cysW,291,unreviewed (tr),tr|A6TC60|A6TC60_KLEP7 Sulfate transport system permease protein CysW OS=Klebsiella pneumoniae subsp,False
tr|A6TC61|A6TC61_KLEP7,cysU,277,unreviewed (tr),tr|A6TC61|A6TC61_KLEP7 Sulfate transport system permease protein CysT OS=Klebsiella pneumoniae subsp,False
tr|A6TC63|A6TC63_KLEP7,yfeX,299,unreviewed (tr),tr|A6TC63|A6TC63_KLEP7 Dyp-type peroxidase OS=Klebsiella pneumoniae subsp. pneumoniae (strain ATCC 7,False
tr|A6TC67|A6TC67_KLEP7,amiA,290,unreviewed (tr),tr|A6TC67|A6TC67_KLEP7 N-acetylmuramoyl-L-alanine amidase AmiA OS=Klebsiella pneumoniae subsp. pneum,False
tr|A6TC80|A6TC80_KLEP7,cchA,96,unreviewed (tr),tr|A6TC80|A6TC80_KLEP7 Bacterial microcompartment shell protein EutM OS=Klebsiella pneumoniae subsp.,False
tr|A6TC87|A6TC87_KLEP7,talA,318,unreviewed (tr),tr|A6TC87|A6TC87_KLEP7 Transaldolase OS=Klebsiella pneumoniae subsp. pneumoniae (strain ATCC 700721 ,False
tr|A6TC92|A6TC92_KLEP7,acrD,1037,unreviewed (tr),tr|A6TC92|A6TC92_KLEP7 Efflux pump membrane transporter OS=Klebsiella pneumoniae subsp. pneumoniae (,False
tr|A6TC95|A6TC95_KLEP7,yhaI,67,unreviewed (tr),tr|A6TC95|A6TC95_KLEP7 UPF0370 protein KPN_02806 OS=Klebsiella pneumoniae subsp. pneumoniae (strain ,False
sp|A6TC99|PUR7_KLEP7,purC,237,reviewed (sp),sp|A6TC99|PUR7_KLEP7 Phosphoribosylaminoimidazole-succinocarboxamide synthase OS=Klebsiella pneumoni,False
tr|A6TCA0|A6TCA0_KLEP7,nlpB,344,unreviewed (tr),tr|A6TCA0|A6TCA0_KLEP7 Outer membrane protein assembly factor BamC OS=Klebsiella pneumoniae subsp. p,False
sp|A6TCA8|HDA_KLEP7,hda,225,reviewed (sp),sp|A6TCA8|HDA_KLEP7 DnaA regulatory inactivator Hda OS=Klebsiella pneumoniae subsp. pneumoniae (stra,False
tr|A6TCB6|A6TCB6_KLEP7,ppx,510,unreviewed (tr),tr|A6TCB6|A6TCB6_KLEP7 Exopolyphosphatase OS=Klebsiella pneumoniae subsp. pneumoniae (strain ATCC 70,False
sp|A6TCC4|EX7L_KLEP7,xseA,463,reviewed (sp),sp|A6TCC4|EX7L_KLEP7 Exodeoxyribonuclease 7 large subunit OS=Klebsiella pneumoniae subsp. pneumoniae,False
sp|A6TCD0|DER_KLEP7,der,492,reviewed (sp),sp|A6TCD0|DER_KLEP7 GTPase Der OS=Klebsiella pneumoniae subsp. pneumoniae (strain ATCC 700721 / MGH ,True
tr|A6TCD1|A6TCD1_KLEP7,yfgL,392,unreviewed (tr),tr|A6TCD1|A6TCD1_KLEP7 Outer membrane protein assembly factor BamB OS=Klebsiella pneumoniae subsp. p,False
tr|A6TCD3|A6TCD3_KLEP7,hisS,414,unreviewed (tr),tr|A6TCD3|A6TCD3_KLEP7 Histidine--tRNA ligase OS=Klebsiella pneumoniae subsp. pneumoniae (strain ATC,True
tr|A6TCD8|A6TCD8_KLEP7,pbpC,774,unreviewed (tr),tr|A6TCD8|A6TCD8_KLEP7 peptidoglycan glycosyltransferase OS=Klebsiella pneumoniae subsp. pneumoniae ,False
tr|A6TCD9|A6TCD9_KLEP7,yfhM,1649,unreviewed (tr),tr|A6TCD9|A6TCD9_KLEP7 Alpha-2-macroglobulin OS=Klebsiella pneumoniae subsp. pneumoniae (strain ATCC,False
tr|A6TCE5|A6TCE5_KLEP7,yfhJ,66,unreviewed (tr),tr|A6TCE5|A6TCE5_KLEP7 Protein IscX OS=Klebsiella pneumoniae subsp. pneumoniae (strain ATCC 700721 /,False
tr|A6TCE6|A6TCE6_KLEP7,fdx,111,unreviewed (tr),tr|A6TCE6|A6TCE6_KLEP7 2Fe-2S ferredoxin OS=Klebsiella pneumoniae subsp. pneumoniae (strain ATCC 700,False
sp|A6TCE7|HSCA_KLEP7,hscA,616,reviewed (sp),sp|A6TCE7|HSCA_KLEP7 Chaperone protein HscA OS=Klebsiella pneumoniae subsp. pneumoniae (strain ATCC ,False
sp|A6TCE8|HSCB_KLEP7,hscB,171,reviewed (sp),sp|A6TCE8|HSCB_KLEP7 Co-chaperone protein HscB OS=Klebsiella pneumoniae subsp. pneumoniae (strain AT,False
sp|A6TCE9|ISCA_KLEP7,iscA,107,reviewed (sp),sp|A6TCE9|ISCA_KLEP7 Iron-binding protein IscA OS=Klebsiella pneumoniae subsp. pneumoniae (strain AT,False
tr|A6TCF0|A6TCF0_KLEP7,iscU,128,unreviewed (tr),tr|A6TCF0|A6TCF0_KLEP7 Iron-sulfur cluster assembly scaffold protein IscU OS=Klebsiella pneumoniae s,False
sp|A6TCF2|ISCR_KLEP7,iscR,163,reviewed (sp),sp|A6TCF2|ISCR_KLEP7 HTH-type transcriptional regulator IscR OS=Klebsiella pneumoniae subsp. pneumon,False
tr|A6TCF6|A6TCF6_KLEP7,yohM,326,unreviewed (tr),tr|A6TCF6|A6TCF6_KLEP7 Nickel/cobalt efflux system OS=Klebsiella pneumoniae subsp. pneumoniae (strai,False
tr|A6TCG1|A6TCG1_KLEP7,KPN_02872,499,unreviewed (tr),tr|A6TCG1|A6TCG1_KLEP7 D-xylose-proton symporter OS=Klebsiella pneumoniae subsp. pneumoniae (strain ,False
tr|A6TCG7|A6TCG7_KLEP7,glnB,112,unreviewed (tr),tr|A6TCG7|A6TCG7_KLEP7 Nitrogen assimilation by glutamine synthetase (ATase) regulatory protein (P-I,False
tr|A6TCH0|A6TCH0_KLEP7,yfhK,479,unreviewed (tr),tr|A6TCH0|A6TCH0_KLEP7 histidine kinase OS=Klebsiella pneumoniae subsp. pneumoniae (strain ATCC 7007,False
tr|A6TCH3|A6TCH3_KLEP7,tadA,172,unreviewed (tr),tr|A6TCH3|A6TCH3_KLEP7 tRNA-specific adenosine deaminase OS=Klebsiella pneumoniae subsp. pneumoniae ,False
sp|A6TCH7|ACPS_KLEP7,acpS,126,reviewed (sp),sp|A6TCH7|ACPS_KLEP7 Holo-[acyl-carrier-protein] synthase OS=Klebsiella pneumoniae subsp. pneumoniae,False
sp|A6TCH9|RECO_KLEP7,recO,245,reviewed (sp),sp|A6TCH9|RECO_KLEP7 DNA repair protein RecO OS=Klebsiella pneumoniae subsp. pneumoniae (strain ATCC,False
tr|A6TCI2|A6TCI2_KLEP7,lepB,324,unreviewed (tr),tr|A6TCI2|A6TCI2_KLEP7 Signal peptidase I OS=Klebsiella pneumoniae subsp. pneumoniae (strain ATCC 70,False
tr|A6TCI6|A6TCI6_KLEP7,rseA,216,unreviewed (tr),tr|A6TCI6|A6TCI6_KLEP7 Anti-sigma-E factor RseA OS=Klebsiella pneumoniae subsp. pneumoniae (strain A,False
tr|A6TCI7|A6TCI7_KLEP7,rpoE,191,unreviewed (tr),tr|A6TCI7|A6TCI7_KLEP7 ECF RNA polymerase sigma-E factor OS=Klebsiella pneumoniae subsp. pneumoniae ,True
tr|A6TCI8|A6TCI8_KLEP7,nadB,539,unreviewed (tr),tr|A6TCI8|A6TCI8_KLEP7 L-aspartate oxidase OS=Klebsiella pneumoniae subsp. pneumoniae (strain ATCC 7,False
sp|A6TCI9|TRMN6_KLEP7,KPN78578_28490,245,reviewed (sp),sp|A6TCI9|TRMN6_KLEP7 tRNA1(Val) (adenine(37)-N6)-methyltransferase OS=Klebsiella pneumoniae subsp. ,False
sp|A6TCJ1|GRCA_KLEP7,grcA,127,reviewed (sp),sp|A6TCJ1|GRCA_KLEP7 Autonomous glycyl radical cofactor OS=Klebsiella pneumoniae subsp. pneumoniae (,False
sp|A6TCJ2|UNG_KLEP7,ung,229,reviewed (sp),sp|A6TCJ2|UNG_KLEP7 Uracil-DNA glycosylase OS=Klebsiella pneumoniae subsp. pneumoniae (strain ATCC 7,False
tr|A6TCJ4|A6TCJ4_KLEP7,trxC,141,unreviewed (tr),tr|A6TCJ4|A6TCJ4_KLEP7 Thioredoxin OS=Klebsiella pneumoniae subsp. pneumoniae (strain ATCC 700721 / ,False
tr|A6TCJ6|A6TCJ6_KLEP7,yfiQ,883,unreviewed (tr),tr|A6TCJ6|A6TCJ6_KLEP7 Protein lysine acetyltransferase OS=Klebsiella pneumoniae subsp. pneumoniae (,False
tr|A6TCJ9|A6TCJ9_KLEP7,kgtP,432,unreviewed (tr),tr|A6TCJ9|A6TCJ9_KLEP7 Alpha-ketoglutarate permease OS=Klebsiella pneumoniae subsp. pneumoniae (stra,False
tr|A6TCK0|A6TCK0_KLEP7,clpB,857,unreviewed (tr),tr|A6TCK0|A6TCK0_KLEP7 Chaperone protein ClpB OS=Klebsiella pneumoniae subsp. pneumoniae (strain ATC,False
tr|A6TCK1|A6TCK1_KLEP7,r'rH,243,unreviewed (tr),tr|A6TCK1|A6TCK1_KLEP7 Purine nucleoside phosphorylase OS=Klebsiella pneumoniae subsp. pneumoniae (s,False
tr|A6TCK2|A6TCK2_KLEP7,rluD,326,unreviewed (tr),tr|A6TCK2|A6TCK2_KLEP7 Pseudouridine synthase OS=Klebsiella pneumoniae subsp. pneumoniae (strain ATC,False
tr|A6TCK3|A6TCK3_KLEP7,yfiO,245,unreviewed (tr),tr|A6TCK3|A6TCK3_KLEP7 Outer membrane protein assembly factor BamD OS=Klebsiella pneumoniae subsp. p,False
tr|A6TCK7|A6TCK7_KLEP7,tyrA,373,unreviewed (tr),tr|A6TCK7|A6TCK7_KLEP7 T-protein OS=Klebsiella pneumoniae subsp. pneumoniae (strain ATCC 700721 / MG,False
tr|A6TCK8|A6TCK8_KLEP7,aroF,356,unreviewed (tr),tr|A6TCK8|A6TCK8_KLEP7 Phospho-2-dehydro-3-deoxyheptonate aldolase OS=Klebsiella pneumoniae subsp. p,False
sp|A6TCL4|RL19_KLEP7,rplS,115,reviewed (sp),sp|A6TCL4|RL19_KLEP7 Large ribosomal subunit protein bL19 OS=Klebsiella pneumoniae subsp. pneumoniae,True
sp|A6TCL5|TRMD_KLEP7,trmD,255,reviewed (sp),sp|A6TCL5|TRMD_KLEP7 tRNA (guanine-N(1)-)-methyltransferase OS=Klebsiella pneumoniae subsp. pneumoni,True
sp|A6TCL6|RIMM_KLEP7,rimM,182,reviewed (sp),sp|A6TCL6|RIMM_KLEP7 Ribosome maturation factor RimM OS=Klebsiella pneumoniae subsp. pneumoniae (str,True
sp|A6TCL7|RS16_KLEP7,rpsP,82,reviewed (sp),sp|A6TCL7|RS16_KLEP7 Small ribosomal subunit protein bS16 OS=Klebsiella pneumoniae subsp. pneumoniae,True
tr|A6TCM0|A6TCM0_KLEP7,yfjD,428,unreviewed (tr),tr|A6TCM0|A6TCM0_KLEP7 Hemolysins related proteins containing CBS domains OS=Klebsiella pneumoniae s,False
sp|A6TCM1|GRPE_KLEP7,grpE,196,reviewed (sp),sp|A6TCM1|GRPE_KLEP7 Protein GrpE OS=Klebsiella pneumoniae subsp. pneumoniae (strain ATCC 700721 / M,True
tr|A6TCM3|A6TCM3_KLEP7,recN,553,unreviewed (tr),tr|A6TCM3|A6TCM3_KLEP7 DNA repair protein RecN OS=Klebsiella pneumoniae subsp. pneumoniae (strain AT,False
tr|A6TCM4|A6TCM4_KLEP7,smpA,113,unreviewed (tr),tr|A6TCM4|A6TCM4_KLEP7 Outer membrane protein assembly factor BamE OS=Klebsiella pneumoniae subsp. p,False
sp|A6TCM7|SSRP_KLEP7,smpB,160,reviewed (sp),sp|A6TCM7|SSRP_KLEP7 SsrA-binding protein OS=Klebsiella pneumoniae subsp. pneumoniae (strain ATCC 70,False
tr|A6TCP2|A6TCP2_KLEP7,KPN_02957,211,unreviewed (tr),tr|A6TCP2|A6TCP2_KLEP7 3-dehydro-L-gulonate-6-phosphate decarboxylase OS=Klebsiella pneumoniae subsp,False
tr|A6TCP4|A6TCP4_KLEP7,KPN_02959,280,unreviewed (tr),tr|A6TCP4|A6TCP4_KLEP7 glucose-6-phosphate isomerase OS=Klebsiella pneumoniae subsp. pneumoniae (str,False
tr|A6TCP5|A6TCP5_KLEP7,KPN_02960,491,unreviewed (tr),tr|A6TCP5|A6TCP5_KLEP7 PTS system glucose-specific EIICB component OS=Klebsiella pneumoniae subsp. p,False
tr|A6TCQ5|A6TCQ5_KLEP7,KPN_02970,1050,unreviewed (tr),tr|A6TCQ5|A6TCQ5_KLEP7 Efflux pump membrane transporter OS=Klebsiella pneumoniae subsp. pneumoniae (,False
tr|A6TCR2|A6TCR2_KLEP7,KPN_02977,506,unreviewed (tr),tr|A6TCR2|A6TCR2_KLEP7 Glutamine ABC transporter ATP-binding component OS=Klebsiella pneumoniae subs,False
tr|A6TCT4|A6TCT4_KLEP7,ygaW,149,unreviewed (tr),tr|A6TCT4|A6TCT4_KLEP7 L-alanine exporter AlaE OS=Klebsiella pneumoniae subsp. pneumoniae (strain AT,False
tr|A6TCU1|A6TCU1_KLEP7,nrdE,693,unreviewed (tr),tr|A6TCU1|A6TCU1_KLEP7 Ribonucleoside-diphosphate reductase OS=Klebsiella pneumoniae subsp. pneumoni,False
tr|A6TCU2|A6TCU2_KLEP7,nrdF,320,unreviewed (tr),tr|A6TCU2|A6TCU2_KLEP7 Ribonucleoside-diphosphate reductase subunit beta OS=Klebsiella pneumoniae su,False
tr|A6TCU3|A6TCU3_KLEP7,proV,400,unreviewed (tr),tr|A6TCU3|A6TCU3_KLEP7 Quaternary amine transport ATP-binding protein OS=Klebsiella pneumoniae subsp,False
tr|A6TCU4|A6TCU4_KLEP7,proW,355,unreviewed (tr),"tr|A6TCU4|A6TCU4_KLEP7 Glycine/betaine/proline transport protein (ABC superfamily, membrane) OS=Kleb",False
tr|A6TCU9|A6TCU9_KLEP7,emrA,390,unreviewed (tr),tr|A6TCU9|A6TCU9_KLEP7 Multidrug resistance secretion protein OS=Klebsiella pneumoniae subsp. pneumo,False
tr|A6TCV3|A6TCV3_KLEP7,ygaG,158,unreviewed (tr),tr|A6TCV3|A6TCV3_KLEP7 S-ribosylhomocysteine lyase OS=Klebsiella pneumoniae subsp. pneumoniae (strai,False
sp|A6TCV4|GSH1_KLEP7,gshA,518,reviewed (sp),sp|A6TCV4|GSH1_KLEP7 Glutamate--cysteine ligase OS=Klebsiella pneumoniae subsp. pneumoniae (strain A,False
sp|A6TCV8|CSRA_KLEP7,csrA,61,reviewed (sp),sp|A6TCV8|CSRA_KLEP7 Translational regulator CsrA OS=Klebsiella pneumoniae subsp. pneumoniae (strain,False
sp|A6TCW0|RECX_KLEP7,recX,166,reviewed (sp),sp|A6TCW0|RECX_KLEP7 Regulatory protein RecX OS=Klebsiella pneumoniae subsp. pneumoniae (strain ATCC,False
sp|A6TCW1|RECA_KLEP7,recA,352,reviewed (sp),sp|A6TCW1|RECA_KLEP7 Protein RecA OS=Klebsiella pneumoniae subsp. pneumoniae (strain ATCC 700721 / M,False
tr|A6TCX3|A6TCX3_KLEP7,gutQ,321,unreviewed (tr),tr|A6TCX3|A6TCX3_KLEP7 Arabinose 5-phosphate isomerase OS=Klebsiella pneumoniae subsp. pneumoniae (s,False
sp|A6TCX4|NORR_KLEP7,norR,516,reviewed (sp),sp|A6TCX4|NORR_KLEP7 Anaerobic nitric oxide reductase transcription regulator NorR OS=Klebsiella pne,False
sp|A6TCX6|NORW_KLEP7,norW,377,reviewed (sp),sp|A6TCX6|NORW_KLEP7 Nitric oxide reductase FlRd-NAD(+) reductase OS=Klebsiella pneumoniae subsp. pn,False
tr|A6TCX7|A6TCX7_KLEP7,KPN_03047,337,unreviewed (tr),tr|A6TCX7|A6TCX7_KLEP7 Nickel/cobalt efflux system OS=Klebsiella pneumoniae subsp. pneumoniae (strai,False
tr|A6TCY1|A6TCY1_KLEP7,ascF,480,unreviewed (tr),"tr|A6TCY1|A6TCY1_KLEP7 PTS family enzyme IIBC component, cellobiose/salicin/arbutin-specific OS=Kleb",False
tr|A6TCY6|A6TCY6_KLEP7,hycG,255,unreviewed (tr),tr|A6TCY6|A6TCY6_KLEP7 NADH:ubiquinone oxidoreductase-like 20kDa subunit domain-containing protein O,False
tr|A6TCY8|A6TCY8_KLEP7,hycE,569,unreviewed (tr),"tr|A6TCY8|A6TCY8_KLEP7 Hydrogenase 3, large subunit (Part of FHL complex) OS=Klebsiella pneumoniae s",False
tr|A6TCZ1|A6TCZ1_KLEP7,hycB,169,unreviewed (tr),tr|A6TCZ1|A6TCZ1_KLEP7 Formate hydrogenlyase subunit 2 OS=Klebsiella pneumoniae subsp. pneumoniae (s,False
sp|A6TCZ3|HYPA_KLEP7,hypA,114,reviewed (sp),sp|A6TCZ3|HYPA_KLEP7 Hydrogenase maturation factor HypA OS=Klebsiella pneumoniae subsp. pneumoniae (,False
tr|A6TCZ4|A6TCZ4_KLEP7,hypB,290,unreviewed (tr),tr|A6TCZ4|A6TCZ4_KLEP7 Hydrogenase maturation factor HypB OS=Klebsiella pneumoniae subsp. pneumoniae,False
tr|A6TCZ5|A6TCZ5_KLEP7,hypC,90,unreviewed (tr),tr|A6TCZ5|A6TCZ5_KLEP7 Hydrogenase maturation factor HybG OS=Klebsiella pneumoniae subsp. pneumoniae,False
tr|A6TD00|A6TD00_KLEP7,KPN_03070,730,unreviewed (tr),"tr|A6TD00|A6TD00_KLEP7 mannan endo-1,4-beta-mannosidase OS=Klebsiella pneumoniae subsp. pneumoniae (",False
tr|A6TD01|A6TD01_KLEP7,KPN_03071,445,unreviewed (tr),tr|A6TD01|A6TD01_KLEP7 Maltoporin OS=Klebsiella pneumoniae subsp. pneumoniae (strain ATCC 700721 / M,False
tr|A6TD10|A6TD10_KLEP7,sitC,282,unreviewed (tr),tr|A6TD10|A6TD10_KLEP7 Iron transporter: fur regulated OS=Klebsiella pneumoniae subsp. pneumoniae (s,False
tr|A6TD11|A6TD11_KLEP7,sitD,284,unreviewed (tr),tr|A6TD11|A6TD11_KLEP7 Iron transporter: fur regulated OS=Klebsiella pneumoniae subsp. pneumoniae (s,False
sp|A6TD24|MUTS_KLEP7,mutS,853,reviewed (sp),sp|A6TD24|MUTS_KLEP7 DNA mismatch repair protein MutS OS=Klebsiella pneumoniae subsp. pneumoniae (st,False
tr|A6TD27|A6TD27_KLEP7,KPN_03097,475,unreviewed (tr),tr|A6TD27|A6TD27_KLEP7 Phenolic acid decarboxylase OS=Klebsiella pneumoniae subsp. pneumoniae (strai,False
tr|A6TD28|A6TD28_KLEP7,KPN_03098,197,unreviewed (tr),tr|A6TD28|A6TD28_KLEP7 Probable UbiX-like flavin prenyltransferase OS=Klebsiella pneumoniae subsp. p,False
tr|A6TD33|A6TD33_KLEP7,rpoS,330,unreviewed (tr),tr|A6TD33|A6TD33_KLEP7 RNA polymerase sigma factor RpoS OS=Klebsiella pneumoniae subsp. pneumoniae (,False
tr|A6TD34|A6TD34_KLEP7,nlpD,378,unreviewed (tr),tr|A6TD34|A6TD34_KLEP7 Murein hydrolase activator NlpD OS=Klebsiella pneumoniae subsp. pneumoniae (s,False
sp|A6TD39|ISPD_KLEP7,ispD,236,reviewed (sp),sp|A6TD39|ISPD_KLEP7 2-C-methyl-D-erythritol 4-phosphate cytidylyltransferase OS=Klebsiella pneumoni,False
sp|A6TD40|FTSB_KLEP7,ftsB,105,reviewed (sp),sp|A6TD40|FTSB_KLEP7 Cell division protein FtsB OS=Klebsiella pneumoniae subsp. pneumoniae (strain A,False
tr|A6TD50|A6TD50_KLEP7,ygcM,121,unreviewed (tr),"tr|A6TD50|A6TD50_KLEP7 6-carboxy-5,6,7,8-tetrahydropterin synthase OS=Klebsiella pneumoniae subsp. p",False
tr|A6TD55|A6TD55_KLEP7,mazG,263,unreviewed (tr),tr|A6TD55|A6TD55_KLEP7 Nucleoside triphosphate pyrophosphohydrolase OS=Klebsiella pneumoniae subsp. ,False
