uniprot_id,gene_name,length,entry_type,description,is_essential
tr|A6T7N5|A6T7N5_KLEP7,yoaF,79,unreviewed (tr),tr|A6T7N5|A6T7N5_KLEP7 DUF333 domain-containing protein OS=Klebsiella pneumoniae subsp. pneumoniae (,False
tr|A6T7N6|A6T7N6_KLEP7,yeaO,119,unreviewed (tr),tr|A6T7N6|A6T7N6_KLEP7 DUF488 domain-containing protein OS=Klebsiella pneumoniae subsp. pneumoniae (,False
tr|A6T7N7|A6T7N7_KLEP7,yhjR,158,unreviewed (tr),tr|A6T7N7|A6T7N7_KLEP7 Uncharacterized protein OS=Klebsiella pneumoniae subsp. pneumoniae (strain AT,False
tr|A6T7N8|A6T7N8_KLEP7,yeaN,394,unreviewed (tr),tr|A6T7N8|A6T7N8_KLEP7 Amino acid/amine transport protein OS=Klebsiella pneumoniae subsp. pneumoniae,False
tr|A6T7N9|A6T7N9_KLEP7,yeaM,264,unreviewed (tr),tr|A6T7N9|A6T7N9_KLEP7 ARAC-type regulatory protein OS=Klebsiella pneumoniae subsp. pneumoniae (stra,False
sp|A6T7P0|Y1150_KLEP7,KPN78578_11500,148,reviewed (sp),sp|A6T7P0|Y1150_KLEP7 UPF0756 membrane protein KPN78578_11500 OS=Klebsiella pneumoniae subsp. pneumo,False
tr|A6T7P1|A6T7P1_KLEP7,yeaK,166,unreviewed (tr),tr|A6T7P1|A6T7P1_KLEP7 YbaK/aminoacyl-tRNA synthetase-associated domain-containing protein OS=Klebsi,False
tr|A6T7P2|A6T7P2_KLEP7,KPN_01180,342,unreviewed (tr),tr|A6T7P2|A6T7P2_KLEP7 Glycosyl transferase OS=Klebsiella pneumoniae subsp. pneumoniae (strain ATCC ,False
tr|A6T7P3|A6T7P3_KLEP7,KPN_01181,80,unreviewed (tr),tr|A6T7P3|A6T7P3_KLEP7 DinI-like protein OS=Klebsiella pneumoniae subsp. pneumoniae (strain ATCC 700,False
tr|A6T7P4|A6T7P4_KLEP7,KPN_01182,423,unreviewed (tr),tr|A6T7P4|A6T7P4_KLEP7 Reverse transcriptase OS=Klebsiella pneumoniae subsp. pneumoniae (strain ATCC,False
tr|A6T7P5|A6T7P5_KLEP7,KPN_01183,139,unreviewed (tr),tr|A6T7P5|A6T7P5_KLEP7 SOS mutagenesis error-prone repair processed to UmuD' forms complex with UmuC,False
tr|A6T7P7|A6T7P7_KLEP7,KPN_01185,301,unreviewed (tr),tr|A6T7P7|A6T7P7_KLEP7 Transcriptional regulator (LysR family) OS=Klebsiella pneumoniae subsp. pneum,False
tr|A6T7P8|A6T7P8_KLEP7,KPN_01186,249,unreviewed (tr),tr|A6T7P8|A6T7P8_KLEP7 Oxidoreductase OS=Klebsiella pneumoniae subsp. pneumoniae (strain ATCC 700721,False
tr|A6T7P9|A6T7P9_KLEP7,KPN_01187,405,unreviewed (tr),tr|A6T7P9|A6T7P9_KLEP7 Sugar efflux transporter OS=Klebsiella pneumoniae subsp. pneumoniae (strain A,False
tr|A6T7Q0|A6T7Q0_KLEP7,KPN_01188,260,unreviewed (tr),tr|A6T7Q0|A6T7Q0_KLEP7 Transcriptional regulator (LysR family) OS=Klebsiella pneumoniae subsp. pneum,False
tr|A6T7Q1|A6T7Q1_KLEP7,KPN_01189,103,unreviewed (tr),tr|A6T7Q1|A6T7Q1_KLEP7 Antibiotic biosynthesis monooxygenase OS=Klebsiella pneumoniae subsp. pneumon,False
tr|A6T7Q2|A6T7Q2_KLEP7,KPN_01190,160,unreviewed (tr),tr|A6T7Q2|A6T7Q2_KLEP7 Glutathione peroxidase OS=Klebsiella pneumoniae subsp. pneumoniae (strain ATC,False
tr|A6T7Q3|A6T7Q3_KLEP7,KPN_01191,187,unreviewed (tr),tr|A6T7Q3|A6T7Q3_KLEP7 Lipoprotein OS=Klebsiella pneumoniae subsp. pneumoniae (strain ATCC 700721 / ,False
sp|A6T7Q4|Y1164_KLEP7,KPN78578_11640,427,reviewed (sp),sp|A6T7Q4|Y1164_KLEP7 UPF0229 protein KPN78578_11640 OS=Klebsiella pneumoniae subsp. pneumoniae (str,False
tr|A6T7Q6|A6T7Q6_KLEP7,mipA,248,unreviewed (tr),tr|A6T7Q6|A6T7Q6_KLEP7 Scaffolding protein for murein-synthesising holoenzyme OS=Klebsiella pneumoni,False
tr|A6T7Q7|A6T7Q7_KLEP7,yeaE,294,unreviewed (tr),tr|A6T7Q7|A6T7Q7_KLEP7 An aldehyde reductase OS=Klebsiella pneumoniae subsp. pneumoniae (strain ATCC,False
tr|A6T7R1|A6T7R1_KLEP7,yeaC,92,unreviewed (tr),tr|A6T7R1|A6T7R1_KLEP7 YeaC family protein OS=Klebsiella pneumoniae subsp. pneumoniae (strain ATCC 7,False
tr|A6T7R2|A6T7R2_KLEP7,KPN_01200,114,unreviewed (tr),tr|A6T7R2|A6T7R2_KLEP7 Putative HNH nuclease YajD OS=Klebsiella pneumoniae subsp. pneumoniae (strain,False
tr|A6T7S1|A6T7S1_KLEP7,KPN_01209,326,unreviewed (tr),tr|A6T7S1|A6T7S1_KLEP7 Zinc-containing alcohol dehydrogenase superfamily OS=Klebsiella pneumoniae su,False
tr|A6T7S3|A6T7S3_KLEP7,nudG,138,unreviewed (tr),tr|A6T7S3|A6T7S3_KLEP7 CTP pyrophosphohydrolase OS=Klebsiella pneumoniae subsp. pneumoniae (strain A,False
tr|A6T7S4|A6T7S4_KLEP7,ynjF,207,unreviewed (tr),tr|A6T7S4|A6T7S4_KLEP7 Cytochrome oxidase OS=Klebsiella pneumoniae subsp. pneumoniae (strain ATCC 70,False
tr|A6T7S5|A6T7S5_KLEP7,ynjE,435,unreviewed (tr),tr|A6T7S5|A6T7S5_KLEP7 Sulfurtransferase OS=Klebsiella pneumoniae subsp. pneumoniae (strain ATCC 700,False
tr|A6T7S6|A6T7S6_KLEP7,ynjD,210,unreviewed (tr),tr|A6T7S6|A6T7S6_KLEP7 ATP-binding component of a transport system OS=Klebsiella pneumoniae subsp. p,False
tr|A6T7S7|A6T7S7_KLEP7,ynjC,511,unreviewed (tr),"tr|A6T7S7|A6T7S7_KLEP7 Transport protein (ABC superfamily, membrane) OS=Klebsiella pneumoniae subsp.",False
tr|A6T7S8|A6T7S8_KLEP7,ynjB,392,unreviewed (tr),tr|A6T7S8|A6T7S8_KLEP7 ABC transporter substrate-binding protein OS=Klebsiella pneumoniae subsp. pne,False
tr|A6T7S9|A6T7S9_KLEP7,ynjA,186,unreviewed (tr),tr|A6T7S9|A6T7S9_KLEP7 Carboxymuconolactone decarboxylase-like domain-containing protein OS=Klebsiel,False
tr|A6T7T0|A6T7T0_KLEP7,ydjZ,236,unreviewed (tr),tr|A6T7T0|A6T7T0_KLEP7 TVP38/TMEM64 family membrane protein OS=Klebsiella pneumoniae subsp. pneumoni,False
tr|A6T7T1|A6T7T1_KLEP7,ydjX,218,unreviewed (tr),tr|A6T7T1|A6T7T1_KLEP7 VTT domain-containing protein OS=Klebsiella pneumoniae subsp. pneumoniae (str,False
tr|A6T7T8|A6T7T8_KLEP7,spy,161,unreviewed (tr),tr|A6T7T8|A6T7T8_KLEP7 Periplasmic protein OS=Klebsiella pneumoniae subsp. pneumoniae (strain ATCC 7,False
tr|A6T7U1|A6T7U1_KLEP7,osmE,112,unreviewed (tr),tr|A6T7U1|A6T7U1_KLEP7 Activator of ntrL protein OS=Klebsiella pneumoniae subsp. pneumoniae (strain ,False
tr|A6T7U2|A6T7U2_KLEP7,celA,93,unreviewed (tr),tr|A6T7U2|A6T7U2_KLEP7 PEP-dependent phosphotransferase enzyme IV OS=Klebsiella pneumoniae subsp. pn,False
tr|A6T7U5|A6T7U5_KLEP7,celD,274,unreviewed (tr),tr|A6T7U5|A6T7U5_KLEP7 Negative transcriptional regulator of cel operon OS=Klebsiella pneumoniae sub,False
tr|A6T7U9|A6T7U9_KLEP7,cedA,110,unreviewed (tr),tr|A6T7U9|A6T7U9_KLEP7 Cell division activator OS=Klebsiella pneumoniae subsp. pneumoniae (strain AT,False
tr|A6T7V0|A6T7V0_KLEP7,ydjN,463,unreviewed (tr),tr|A6T7V0|A6T7V0_KLEP7 Bifunctional putative transport protein/putative kinase OS=Klebsiella pneumon,False
tr|A6T7V1|A6T7V1_KLEP7,ydjM,196,unreviewed (tr),tr|A6T7V1|A6T7V1_KLEP7 LexA regulated protein OS=Klebsiella pneumoniae subsp. pneumoniae (strain ATC,False
tr|A6T7V3|A6T7V3_KLEP7,yniC,222,unreviewed (tr),"tr|A6T7V3|A6T7V3_KLEP7 Enzyme, with a phophatase-like domain OS=Klebsiella pneumoniae subsp. pneumon",False
tr|A6T7V4|A6T7V4_KLEP7,yniB,178,unreviewed (tr),tr|A6T7V4|A6T7V4_KLEP7 Transmembrane protein OS=Klebsiella pneumoniae subsp. pneumoniae (strain ATCC,False
sp|A6T7V8|Y1218_KLEP7,KPN78578_12180,247,reviewed (sp),sp|A6T7V8|Y1218_KLEP7 UPF0259 membrane protein KPN78578_12180 OS=Klebsiella pneumoniae subsp. pneumo,False
tr|A6T7V9|A6T7V9_KLEP7,ykgJ,137,unreviewed (tr),tr|A6T7V9|A6T7V9_KLEP7 Ferredoxin OS=Klebsiella pneumoniae subsp. pneumoniae (strain ATCC 700721 / M,False
tr|A6T7W0|A6T7W0_KLEP7,yciD,224,unreviewed (tr),tr|A6T7W0|A6T7W0_KLEP7 Outer membrane protein W OS=Klebsiella pneumoniae subsp. pneumoniae (strain A,False
tr|A6T7W2|A6T7W2_KLEP7,ybiL,761,unreviewed (tr),"tr|A6T7W2|A6T7W2_KLEP7 Outer membrane porin protein, putative ferrisiderophore receptor OS=Klebsiell",False
tr|A6T7W3|A6T7W3_KLEP7,KPN_01251,315,unreviewed (tr),tr|A6T7W3|A6T7W3_KLEP7 Dehydrogenase OS=Klebsiella pneumoniae subsp. pneumoniae (strain ATCC 700721 ,False
tr|A6T7W4|A6T7W4_KLEP7,KPN_01252,160,unreviewed (tr),"tr|A6T7W4|A6T7W4_KLEP7 Bacterial regulatory protein, MarR OS=Klebsiella pneumoniae subsp. pneumoniae",False
tr|A6T7X1|A6T7X1_KLEP7,yciO,206,unreviewed (tr),tr|A6T7X1|A6T7X1_KLEP7 Uncharacterized protein YciO OS=Klebsiella pneumoniae subsp. pneumoniae (stra,False
tr|A6T7X2|A6T7X2_KLEP7,KPN_01260,298,unreviewed (tr),"tr|A6T7X2|A6T7X2_KLEP7 Bacterial regulatory protein, LysR OS=Klebsiella pneumoniae subsp. pneumoniae",False
tr|A6T7X3|A6T7X3_KLEP7,KPN_01261,140,unreviewed (tr),tr|A6T7X3|A6T7X3_KLEP7 Uncharacterized protein OS=Klebsiella pneumoniae subsp. pneumoniae (strain AT,False
tr|A6T7X4|A6T7X4_KLEP7,KPN_01262,458,unreviewed (tr),tr|A6T7X4|A6T7X4_KLEP7 PAAR domain-containing protein OS=Klebsiella pneumoniae subsp. pneumoniae (st,False
tr|A6T7X5|A6T7X5_KLEP7,KPN_01263,168,unreviewed (tr),tr|A6T7X5|A6T7X5_KLEP7 PAAR domain-containing protein OS=Klebsiella pneumoniae subsp. pneumoniae (st,False
tr|A6T7X6|A6T7X6_KLEP7,KPN_01264,77,unreviewed (tr),tr|A6T7X6|A6T7X6_KLEP7 Uncharacterized protein OS=Klebsiella pneumoniae subsp. pneumoniae (strain AT,False
tr|A6T7X9|A6T7X9_KLEP7,yciK,266,unreviewed (tr),tr|A6T7X9|A6T7X9_KLEP7 Short chain dehydrogenase OS=Klebsiella pneumoniae subsp. pneumoniae (strain ,False
tr|A6T7Y0|A6T7Y0_KLEP7,sohB,360,unreviewed (tr),tr|A6T7Y0|A6T7Y0_KLEP7 Peptidase OS=Klebsiella pneumoniae subsp. pneumoniae (strain ATCC 700721 / MG,False
tr|A6T7Y1|A6T7Y1_KLEP7,yciN,83,unreviewed (tr),tr|A6T7Y1|A6T7Y1_KLEP7 Protein yciN OS=Klebsiella pneumoniae subsp. pneumoniae (strain ATCC 700721 /,False
tr|A6T7Y3|A6T7Y3_KLEP7,cysB,324,unreviewed (tr),tr|A6T7Y3|A6T7Y3_KLEP7 Transcriptional regulator for cysteine regulon OS=Klebsiella pneumoniae subsp,False
tr|A6T7Z1|A6T7Z1_KLEP7,osmB,46,unreviewed (tr),"tr|A6T7Z1|A6T7Z1_KLEP7 Lipoprotein, osmotically inducible OS=Klebsiella pneumoniae subsp. pneumoniae",False
tr|A6T7Z2|A6T7Z2_KLEP7,yciT,249,unreviewed (tr),tr|A6T7Z2|A6T7Z2_KLEP7 DEOR-type transcriptional regulator OS=Klebsiella pneumoniae subsp. pneumonia,False
sp|A6T7Z3|Y1253_KLEP7,KPN78578_12530,59,reviewed (sp),sp|A6T7Z3|Y1253_KLEP7 UPF0509 protein KPN78578_12530 OS=Klebsiella pneumoniae subsp. pneumoniae (str,False
tr|A6T7Z5|A6T7Z5_KLEP7,yciW,385,unreviewed (tr),tr|A6T7Z5|A6T7Z5_KLEP7 Oxidoreductase OS=Klebsiella pneumoniae subsp. pneumoniae (strain ATCC 700721,False
tr|A6T7Z7|A6T7Z7_KLEP7,KPN_01285,183,unreviewed (tr),tr|A6T7Z7|A6T7Z7_KLEP7 HutD family protein OS=Klebsiella pneumoniae subsp. pneumoniae (strain ATCC 7,False
tr|A6T7Z8|A6T7Z8_KLEP7,KPN_01286,459,unreviewed (tr),tr|A6T7Z8|A6T7Z8_KLEP7 Allantoin permease OS=Klebsiella pneumoniae subsp. pneumoniae (strain ATCC 70,False
tr|A6T7Z9|A6T7Z9_KLEP7,sapF,269,unreviewed (tr),"tr|A6T7Z9|A6T7Z9_KLEP7 Peptide transport protein (ABC superfamily, atp_bind) OS=Klebsiella pneumonia",False
tr|A6T800|A6T800_KLEP7,sapD,330,unreviewed (tr),"tr|A6T800|A6T800_KLEP7 Peptide transport protein (ABC superfamily, atp_bind) OS=Klebsiella pneumonia",False
tr|A6T801|A6T801_KLEP7,sapC,296,unreviewed (tr),tr|A6T801|A6T801_KLEP7 Peptide transport permease protein OS=Klebsiella pneumoniae subsp. pneumoniae,False
tr|A6T802|A6T802_KLEP7,sapB,321,unreviewed (tr),tr|A6T802|A6T802_KLEP7 Peptide transport permease protein OS=Klebsiella pneumoniae subsp. pneumoniae,False
tr|A6T803|A6T803_KLEP7,sapA,547,unreviewed (tr),tr|A6T803|A6T803_KLEP7 Peptide transport periplasmic protein OS=Klebsiella pneumoniae subsp. pneumon,False
tr|A6T804|A6T804_KLEP7,KPN_01292,281,unreviewed (tr),tr|A6T804|A6T804_KLEP7 Transcriptional regulator OS=Klebsiella pneumoniae subsp. pneumoniae (strain ,False
tr|A6T805|A6T805_KLEP7,KPN_01293,773,unreviewed (tr),"tr|A6T805|A6T805_KLEP7 Helix-turn-helix, AraC type OS=Klebsiella pneumoniae subsp. pneumoniae (strai",False
tr|A6T806|A6T806_KLEP7,KPN_01294,389,unreviewed (tr),tr|A6T806|A6T806_KLEP7 Amino acid amidohydrolase OS=Klebsiella pneumoniae subsp. pneumoniae (strain ,False
tr|A6T807|A6T807_KLEP7,KPN_01295,463,unreviewed (tr),tr|A6T807|A6T807_KLEP7 Transmembrane efflux protein OS=Klebsiella pneumoniae subsp. pneumoniae (stra,False
tr|A6T808|A6T808_KLEP7,pspF,329,unreviewed (tr),tr|A6T808|A6T808_KLEP7 Psp operon transcriptional activator OS=Klebsiella pneumoniae subsp. pneumoni,False
tr|A6T809|A6T809_KLEP7,pspA,227,unreviewed (tr),"tr|A6T809|A6T809_KLEP7 Phage shock protein, inner membrane protein OS=Klebsiella pneumoniae subsp. p",False
tr|A6T810|A6T810_KLEP7,pspB,74,unreviewed (tr),tr|A6T810|A6T810_KLEP7 Phage shock protein B OS=Klebsiella pneumoniae subsp. pneumoniae (strain ATCC,False
tr|A6T811|A6T811_KLEP7,pspC,119,unreviewed (tr),tr|A6T811|A6T811_KLEP7 Phage shock protein: activates phage shock-protein expression OS=Klebsiella p,False
tr|A6T812|A6T812_KLEP7,pspD,72,unreviewed (tr),tr|A6T812|A6T812_KLEP7 Phage shock protein OS=Klebsiella pneumoniae subsp. pneumoniae (strain ATCC 7,False
tr|A6T813|A6T813_KLEP7,ycjX,465,unreviewed (tr),tr|A6T813|A6T813_KLEP7 Enzyme OS=Klebsiella pneumoniae subsp. pneumoniae (strain ATCC 700721 / MGH 7,False
sp|A6T814|Y1274_KLEP7,KPN78578_12740,353,reviewed (sp),sp|A6T814|Y1274_KLEP7 UPF0283 membrane protein KPN78578_12740 OS=Klebsiella pneumoniae subsp. pneumo,False
tr|A6T815|A6T815_KLEP7,KPN_01303,299,unreviewed (tr),"tr|A6T815|A6T815_KLEP7 Bacterial regulatory protein, LysR OS=Klebsiella pneumoniae subsp. pneumoniae",False
tr|A6T816|A6T816_KLEP7,KPN_01304,437,unreviewed (tr),tr|A6T816|A6T816_KLEP7 Alpha-galactosidases/6-phospho-beta-glucosidases OS=Klebsiella pneumoniae sub,False
tr|A6T817|A6T817_KLEP7,tyrR,513,unreviewed (tr),tr|A6T817|A6T817_KLEP7 HTH-type transcriptional regulatory protein TyrR OS=Klebsiella pneumoniae sub,False
tr|A6T818|A6T818_KLEP7,KPN_01306,350,unreviewed (tr),tr|A6T818|A6T818_KLEP7 Transport protein OS=Klebsiella pneumoniae subsp. pneumoniae (strain ATCC 700,False
tr|A6T821|A6T821_KLEP7,mppA,538,unreviewed (tr),tr|A6T821|A6T821_KLEP7 Periplasmic murein tripeptide (L-Ala-gamma-D-Glut-m-DAP) permease OS=Klebsiel,False
tr|A6T822|A6T822_KLEP7,KPN_01311,128,unreviewed (tr),"tr|A6T822|A6T822_KLEP7 Glyoxalase I, nickel isomerase OS=Klebsiella pneumoniae subsp. pneumoniae (st",False
tr|A6T823|A6T823_KLEP7,KPN_01312,277,unreviewed (tr),tr|A6T823|A6T823_KLEP7 Uncharacterized protein OS=Klebsiella pneumoniae subsp. pneumoniae (strain AT,False
tr|A6T824|A6T824_KLEP7,KPN_01313,294,unreviewed (tr),tr|A6T824|A6T824_KLEP7 Transcriptional regulator (LysR family) OS=Klebsiella pneumoniae subsp. pneum,False
tr|A6T825|A6T825_KLEP7,KPN_01314,400,unreviewed (tr),tr|A6T825|A6T825_KLEP7 Tranport protein (MFS family) OS=Klebsiella pneumoniae subsp. pneumoniae (str,False
tr|A6T826|A6T826_KLEP7,KPN_01315,278,unreviewed (tr),tr|A6T826|A6T826_KLEP7 Aldo/keto reductase family OS=Klebsiella pneumoniae subsp. pneumoniae (strain,False
tr|A6T827|A6T827_KLEP7,KPN_01316,27,unreviewed (tr),tr|A6T827|A6T827_KLEP7 Uncharacterized protein OS=Klebsiella pneumoniae subsp. pneumoniae (strain AT,False
tr|A6T828|A6T828_KLEP7,KPN_01317,102,unreviewed (tr),tr|A6T828|A6T828_KLEP7 Anti-sigma B factor OS=Klebsiella pneumoniae subsp. pneumoniae (strain ATCC 7,False
tr|A6T829|A6T829_KLEP7,KPN_01318,304,unreviewed (tr),tr|A6T829|A6T829_KLEP7 Transcriptional regulator (LysR family) OS=Klebsiella pneumoniae subsp. pneum,False
tr|A6T830|A6T830_KLEP7,KPN_01319,244,unreviewed (tr),tr|A6T830|A6T830_KLEP7 7-alpha-hydroxysteroid dehydrogenase OS=Klebsiella pneumoniae subsp. pneumoni,False
tr|A6T831|A6T831_KLEP7,KPN_01320,510,unreviewed (tr),"tr|A6T831|A6T831_KLEP7 Metal-dependent phosphohydrolase, HD subdomain OS=Klebsiella pneumoniae subsp",False
tr|A6T832|A6T832_KLEP7,KPN_01321,182,unreviewed (tr),tr|A6T832|A6T832_KLEP7 Intracellular protease/amidase OS=Klebsiella pneumoniae subsp. pneumoniae (st,False
tr|A6T833|A6T833_KLEP7,KPN_01322,163,unreviewed (tr),tr|A6T833|A6T833_KLEP7 Type VI secretion system contractile sheath small subunit OS=Klebsiella pneum,False
tr|A6T834|A6T834_KLEP7,KPN_01323,516,unreviewed (tr),tr|A6T834|A6T834_KLEP7 Type VI secretion system contractile sheath large subunit OS=Klebsiella pneum,False
tr|A6T835|A6T835_KLEP7,KPN_01324,447,unreviewed (tr),tr|A6T835|A6T835_KLEP7 Type VI secretion system baseplate subunit TssK OS=Klebsiella pneumoniae subs,False
tr|A6T836|A6T836_KLEP7,KPN_01325,229,unreviewed (tr),tr|A6T836|A6T836_KLEP7 Type IV / VI secretion system DotU domain-containing protein OS=Klebsiella pn,False
tr|A6T837|A6T837_KLEP7,KPN_01326,568,unreviewed (tr),tr|A6T837|A6T837_KLEP7 Outer membrane protein OS=Klebsiella pneumoniae subsp. pneumoniae (strain ATC,False
tr|A6T838|A6T838_KLEP7,KPN_01327,163,unreviewed (tr),tr|A6T838|A6T838_KLEP7 Hcp family type VI secretion system effector OS=Klebsiella pneumoniae subsp. ,False
tr|A6T839|A6T839_KLEP7,KPN_01328,866,unreviewed (tr),tr|A6T839|A6T839_KLEP7 Protease OS=Klebsiella pneumoniae subsp. pneumoniae (strain ATCC 700721 / MGH,False
tr|A6T840|A6T840_KLEP7,KPN_01329,839,unreviewed (tr),tr|A6T840|A6T840_KLEP7 Type VI secretion system tip protein VgrG OS=Klebsiella pneumoniae subsp. pne,False
tr|A6T841|A6T841_KLEP7,KPN_01330,403,unreviewed (tr),tr|A6T841|A6T841_KLEP7 Uncharacterized protein OS=Klebsiella pneumoniae subsp. pneumoniae (strain AT,False
tr|A6T842|A6T842_KLEP7,KPN_01331,134,unreviewed (tr),tr|A6T842|A6T842_KLEP7 Lipoprotein OS=Klebsiella pneumoniae subsp. pneumoniae (strain ATCC 700721 / ,False
tr|A6T843|A6T843_KLEP7,KPN_01332,33,unreviewed (tr),tr|A6T843|A6T843_KLEP7 Uncharacterized protein OS=Klebsiella pneumoniae subsp. pneumoniae (strain AT,False
tr|A6T844|A6T844_KLEP7,KPN_01333,83,unreviewed (tr),tr|A6T844|A6T844_KLEP7 Lipoprotein OS=Klebsiella pneumoniae subsp. pneumoniae (strain ATCC 700721 / ,False
tr|A6T845|A6T845_KLEP7,KPN_01334,586,unreviewed (tr),tr|A6T845|A6T845_KLEP7 Membrane proteins OS=Klebsiella pneumoniae subsp. pneumoniae (strain ATCC 700,False
tr|A6T846|A6T846_KLEP7,KPN_01335,86,unreviewed (tr),tr|A6T846|A6T846_KLEP7 Uncharacterized protein OS=Klebsiella pneumoniae subsp. pneumoniae (strain AT,False
tr|A6T847|A6T847_KLEP7,KPN_01336,255,unreviewed (tr),tr|A6T847|A6T847_KLEP7 Uncharacterized protein OS=Klebsiella pneumoniae subsp. pneumoniae (strain AT,False
tr|A6T848|A6T848_KLEP7,KPN_01337,129,unreviewed (tr),tr|A6T848|A6T848_KLEP7 Transposase-related protein OS=Klebsiella pneumoniae subsp. pneumoniae (strai,False
tr|A6T849|A6T849_KLEP7,KPN_01338,158,unreviewed (tr),tr|A6T849|A6T849_KLEP7 Transposase-related protein OS=Klebsiella pneumoniae subsp. pneumoniae (strai,False
tr|A6T850|A6T850_KLEP7,KPN_01339,113,unreviewed (tr),tr|A6T850|A6T850_KLEP7 Maltose transport system permease protein OS=Klebsiella pneumoniae subsp. pne,False
tr|A6T851|A6T851_KLEP7,KPN_01340,44,unreviewed (tr),tr|A6T851|A6T851_KLEP7 Uncharacterized protein OS=Klebsiella pneumoniae subsp. pneumoniae (strain AT,False
tr|A6T852|A6T852_KLEP7,KPN_01341,402,unreviewed (tr),tr|A6T852|A6T852_KLEP7 Structural protein OS=Klebsiella pneumoniae subsp. pneumoniae (strain ATCC 70,False
tr|A6T853|A6T853_KLEP7,KPN_01342,1124,unreviewed (tr),tr|A6T853|A6T853_KLEP7 Type VI secretion protein VasK OS=Klebsiella pneumoniae subsp. pneumoniae (st,False
tr|A6T854|A6T854_KLEP7,KPN_01343,532,unreviewed (tr),tr|A6T854|A6T854_KLEP7 ImpA N-terminal domain-containing protein OS=Klebsiella pneumoniae subsp. pne,False
tr|A6T855|A6T855_KLEP7,KPN_01344,351,unreviewed (tr),tr|A6T855|A6T855_KLEP7 Bacterial toxin 44 domain-containing protein OS=Klebsiella pneumoniae subsp. ,False
tr|A6T856|A6T856_KLEP7,KPN_01345,156,unreviewed (tr),tr|A6T856|A6T856_KLEP7 Uncharacterized protein OS=Klebsiella pneumoniae subsp. pneumoniae (strain AT,False
tr|A6T857|A6T857_KLEP7,KPN_01346,322,unreviewed (tr),"tr|A6T857|A6T857_KLEP7 Transposase, IS4 OS=Klebsiella pneumoniae subsp. pneumoniae (strain ATCC 7007",False
tr|A6T858|A6T858_KLEP7,KPN_01347,584,unreviewed (tr),tr|A6T858|A6T858_KLEP7 Type VI secretion system baseplate subunit TssF OS=Klebsiella pneumoniae subs,False
tr|A6T859|A6T859_KLEP7,KPN_01348,19,unreviewed (tr),tr|A6T859|A6T859_KLEP7 Uncharacterized protein OS=Klebsiella pneumoniae subsp. pneumoniae (strain AT,False
tr|A6T860|A6T860_KLEP7,KPN_01349,127,unreviewed (tr),tr|A6T860|A6T860_KLEP7 Uncharacterized protein OS=Klebsiella pneumoniae subsp. pneumoniae (strain AT,False
tr|A6T861|A6T861_KLEP7,KPN_01350,237,unreviewed (tr),tr|A6T861|A6T861_KLEP7 Short-chain alcohol dehydrogenas OS=Klebsiella pneumoniae subsp. pneumoniae (,False
tr|A6T862|A6T862_KLEP7,KPN_01351,197,unreviewed (tr),"tr|A6T862|A6T862_KLEP7 Bacterial regulatory protein, TetR OS=Klebsiella pneumoniae subsp. pneumoniae",False
tr|A6T863|A6T863_KLEP7,yghA,251,unreviewed (tr),tr|A6T863|A6T863_KLEP7 Oxidoreductase OS=Klebsiella pneumoniae subsp. pneumoniae (strain ATCC 700721,False
tr|A6T864|A6T864_KLEP7,yqhC,292,unreviewed (tr),tr|A6T864|A6T864_KLEP7 ARAC-type regulatory protein OS=Klebsiella pneumoniae subsp. pneumoniae (stra,False
tr|A6T865|A6T865_KLEP7,KPN_01354,309,unreviewed (tr),tr|A6T865|A6T865_KLEP7 2'-hydroxyisoflavone reductase OS=Klebsiella pneumoniae subsp. pneumoniae (st,False
tr|A6T866|A6T866_KLEP7,yhjC,301,unreviewed (tr),"tr|A6T866|A6T866_KLEP7 Transcriptional regulator, LysR family OS=Klebsiella pneumoniae subsp. pneumo",False
tr|A6T867|A6T867_KLEP7,KPN_01356,307,unreviewed (tr),"tr|A6T867|A6T867_KLEP7 Bacterial regulatory protein, LysR OS=Klebsiella pneumoniae subsp. pneumoniae",False
tr|A6T868|A6T868_KLEP7,KPN_01357,294,unreviewed (tr),tr|A6T868|A6T868_KLEP7 Metallo-beta-lactamase domain-containing protein OS=Klebsiella pneumoniae sub,False
tr|A6T869|A6T869_KLEP7,KPN_01358,303,unreviewed (tr),tr|A6T869|A6T869_KLEP7 NmrA-like domain-containing protein OS=Klebsiella pneumoniae subsp. pneumonia,False
tr|A6T870|A6T870_KLEP7,KPN_01359,182,unreviewed (tr),"tr|A6T870|A6T870_KLEP7 Bacterial regulatory protein, TetR OS=Klebsiella pneumoniae subsp. pneumoniae",False
tr|A6T871|A6T871_KLEP7,KPN_01360,344,unreviewed (tr),tr|A6T871|A6T871_KLEP7 Zinc-containing alcohol dehydrogenase superfamily OS=Klebsiella pneumoniae su,False
tr|A6T872|A6T872_KLEP7,KPN_01361,391,unreviewed (tr),tr|A6T872|A6T872_KLEP7 Aminotransferase OS=Klebsiella pneumoniae subsp. pneumoniae (strain ATCC 7007,False
tr|A6T873|A6T873_KLEP7,KPN_01362,268,unreviewed (tr),tr|A6T873|A6T873_KLEP7 Lipoprotein OS=Klebsiella pneumoniae subsp. pneumoniae (strain ATCC 700721 / ,False
tr|A6T877|A6T877_KLEP7,KPN_01366,204,unreviewed (tr),tr|A6T877|A6T877_KLEP7 YitT family protein OS=Klebsiella pneumoniae subsp. pneumoniae (strain ATCC 7,False
tr|A6T878|A6T878_KLEP7,KPN_01367,159,unreviewed (tr),tr|A6T878|A6T878_KLEP7 Regulator for leucine (Or lrp) regulon and high-affinity branched-chain amino,False
tr|A6T880|A6T880_KLEP7,KPN_01369,248,unreviewed (tr),tr|A6T880|A6T880_KLEP7 Uncharacterized protein OS=Klebsiella pneumoniae subsp. pneumoniae (strain AT,False
tr|A6T881|A6T881_KLEP7,KPN_01370,64,unreviewed (tr),tr|A6T881|A6T881_KLEP7 Uncharacterized protein OS=Klebsiella pneumoniae subsp. pneumoniae (strain AT,False
tr|A6T882|A6T882_KLEP7,KPN_01371,364,unreviewed (tr),tr|A6T882|A6T882_KLEP7 Oxidoreductase OS=Klebsiella pneumoniae subsp. pneumoniae (strain ATCC 700721,False
tr|A6T883|A6T883_KLEP7,KPN_01372,249,unreviewed (tr),"tr|A6T883|A6T883_KLEP7 Bacterial regulatory protein, DeoR OS=Klebsiella pneumoniae subsp. pneumoniae",False
tr|A6T887|A6T887_KLEP7,KPN_01376,412,unreviewed (tr),tr|A6T887|A6T887_KLEP7 Transposase/integrase OS=Klebsiella pneumoniae subsp. pneumoniae (strain ATCC,False
tr|A6T888|A6T888_KLEP7,KPN_01377,70,unreviewed (tr),tr|A6T888|A6T888_KLEP7 Excisionase OS=Klebsiella pneumoniae subsp. pneumoniae (strain ATCC 700721 / ,False
tr|A6T889|A6T889_KLEP7,KPN_01378,86,unreviewed (tr),tr|A6T889|A6T889_KLEP7 DUF4060 family protein OS=Klebsiella pneumoniae subsp. pneumoniae (strain ATC,False
tr|A6T890|A6T890_KLEP7,KPN_01379,102,unreviewed (tr),tr|A6T890|A6T890_KLEP7 DUF7740 domain-containing protein OS=Klebsiella pneumoniae subsp. pneumoniae ,False
tr|A6T891|A6T891_KLEP7,KPN_01380,203,unreviewed (tr),tr|A6T891|A6T891_KLEP7 dATP/dGTP diphosphohydrolase MazZ domain-containing protein OS=Klebsiella pne,False
tr|A6T892|A6T892_KLEP7,KPN_01381,69,unreviewed (tr),tr|A6T892|A6T892_KLEP7 Uncharacterized protein OS=Klebsiella pneumoniae subsp. pneumoniae (strain AT,False
tr|A6T893|A6T893_KLEP7,KPN_01382,333,unreviewed (tr),tr|A6T893|A6T893_KLEP7 Enterobacterial exodeoxyribonuclease VIII OS=Klebsiella pneumoniae subsp. pne,False
tr|A6T894|A6T894_KLEP7,KPN_01383,1038,unreviewed (tr),tr|A6T894|A6T894_KLEP7 Enterobacterial exodeoxyribonuclease VIII OS=Klebsiella pneumoniae subsp. pne,False
tr|A6T895|A6T895_KLEP7,KPN_01384,118,unreviewed (tr),tr|A6T895|A6T895_KLEP7 DUF1482 family protein OS=Klebsiella pneumoniae subsp. pneumoniae (strain ATC,False
tr|A6T896|A6T896_KLEP7,KPN_01385,102,unreviewed (tr),"tr|A6T896|A6T896_KLEP7 Regulatory protein, LysR:LysR substrate binding domain OS=Klebsiella pneumoni",False
tr|A6T897|A6T897_KLEP7,KPN_01386,57,unreviewed (tr),tr|A6T897|A6T897_KLEP7 Uncharacterized protein OS=Klebsiella pneumoniae subsp. pneumoniae (strain AT,False
tr|A6T898|A6T898_KLEP7,KPN_01387,294,unreviewed (tr),tr|A6T898|A6T898_KLEP7 Serine dehydrogenasease OS=Klebsiella pneumoniae subsp. pneumoniae (strain AT,False
tr|A6T899|A6T899_KLEP7,KPN_01388,154,unreviewed (tr),tr|A6T899|A6T899_KLEP7 Uncharacterized protein OS=Klebsiella pneumoniae subsp. pneumoniae (strain AT,False
tr|A6T8A0|A6T8A0_KLEP7,KPN_01389,264,unreviewed (tr),tr|A6T8A0|A6T8A0_KLEP7 ParB/Spo0J HTH domain-containing protein OS=Klebsiella pneumoniae subsp. pneu,False
tr|A6T8A1|A6T8A1_KLEP7,KPN_01390,295,unreviewed (tr),tr|A6T8A1|A6T8A1_KLEP7 Uncharacterized protein OS=Klebsiella pneumoniae subsp. pneumoniae (strain AT,False
tr|A6T8A3|A6T8A3_KLEP7,KPN_01392,66,unreviewed (tr),tr|A6T8A3|A6T8A3_KLEP7 Uncharacterized protein OS=Klebsiella pneumoniae subsp. pneumoniae (strain AT,False
tr|A6T8A4|A6T8A4_KLEP7,KPN_01393,83,unreviewed (tr),tr|A6T8A4|A6T8A4_KLEP7 Uncharacterized protein OS=Klebsiella pneumoniae subsp. pneumoniae (strain AT,False
tr|A6T8A5|A6T8A5_KLEP7,KPN_01394,89,unreviewed (tr),tr|A6T8A5|A6T8A5_KLEP7 DNA adenine methylase OS=Klebsiella pneumoniae subsp. pneumoniae (strain ATCC,False
tr|A6T8A7|A6T8A7_KLEP7,KPN_01396,147,unreviewed (tr),tr|A6T8A7|A6T8A7_KLEP7 N-acetyltransferase OS=Klebsiella pneumoniae subsp. pneumoniae (strain ATCC 7,False
tr|A6T8A8|A6T8A8_KLEP7,KPN_01397,43,unreviewed (tr),tr|A6T8A8|A6T8A8_KLEP7 Uncharacterized protein OS=Klebsiella pneumoniae subsp. pneumoniae (strain AT,False
